jobId,jobUrl,jobTitle,advertiser,listingDate,workType,location,classification,subClassification,email,phone,experience,xenophobe,jobText
50773457,https://www.seek.co.nz/job/50773457,"Pop Up Store Licensee Job in Adelaide - SEEK","Calendar Club","19 Oct 2020",Contract/Temp,Adelaide,"Self Employment","Self Employment","","   ","","","TXT/50773457.txt	§Pop Up Store Licensee§§More jobs from this company§§§§§§§§Job Description§§Job Header§§Pop Up Store Licensee§§Advertiser: §Calendar Club§§More jobs from this company§§§§Job Information§§Job Listing Date§§19 Oct 2020§§Location§§Adelaide§§Salary§§Run Your Own Store &amp; Earn $1,700-$2,000++ per week§§Work Type§§Contract/Temp§§Classification§§Self Employment§, §Self Employment§§§§§§§§§  §    §    §      §Pop Up Store Licensee §      §        §§        §          §Earn $1,700-$2,000++ per week &amp; get paid weekly.§          §Operate your own retail store at major Shopping Centre over Christmas, with retail at its peak!§          §Short season (6-10 weeks) – November to January. §          §Opportunities available across Australia &amp; New Zealand§        §        § §        §Calendar Club, the largest and most successful pop up retailer ever, is back again for its 26th consecutive year. We’ve opened over 4,000 stores since 1995 and this year will open 120 stores again across Australia and New Zealand.§        §We only trade over the Christmas period when sales are strongest and mall traffic is highest. This maximises your earning potential. §        §Opportunities are limited so act fast…§        § §        §WHAT WE PROVIDE§        §          §A great site in one of the country's best shopping centres. We pay the rent!§          §All shop fittings, point of sale equipment, stock and other equipment - everything you need to make your store looks fantastic.§          §Training and support to ensure your success.§        §        § §        §YOUR ROLE§        §          §Manage store performance, including the sales budget.§          §Ensure high store presentation and customer service standards.§          §Recruit, train and manage your team.§          §Set up and dismantle your store. §        §        § §        § §REQUIREMENTS§        §          §You are a hardworking, physically active go-getter who thrives in a customer service environment. §          §You have a reliable motor vehicle§          §You can source and manage a small team§        §        § §        §This is your opportunity to run a small business in a vibrant shopping centre, with minimal investment and excellent financial incentives. You don’t need retail experience but a background in customer service / retail / hospitality is beneficial.§        § §        §If you want to be part of a national retail group with a long history of success, then:§        §          §Visit our website §http://www.calendarclub.com.au/be-your-own-boss/§ and read all information provided§          §Submit your Expression On Interest on the website with a brief CV including a 100-word description of why you are awesome§        §      §    §    §  §§§ §Earn $1,700-$2,000++ per week &amp; get paid weekly.§ §Operate your own retail store at major Shopping Centre over Christmas, with retail at its peak!§ §Short season (6-10 weeks) – November to January. § §Opportunities available across Australia &amp; New Zealand§ § §  §Calendar Club, the largest and most successful pop up retailer ever, is back again for its 26th consecutive year. We’ve opened over 4,000 stores since 1995 and this year will open 120 stores again across Australia and New Zealand.§  §We only trade over the Christmas period when sales are strongest and mall traffic is highest. This maximises your earning potential. §  §Opportunities are limited so act fast…§  § §  §WHAT WE PROVIDE§ § §A great site in one of the country's best shopping centres. We pay the rent!§ §All shop fittings, point of sale equipment, stock and other equipment - everything you need to make your store looks fantastic.§ §Training and support to ensure your success.§ § §  §YOUR ROLE§ § §Manage store performance, including the sales budget.§ §Ensure high store presentation and customer service standards.§ §Recruit, train and manage your team.§ §Set up and dismantle your store. § § §  § §REQUIREMENTS§ § §You are a hardworking, physically active go-getter who thrives in a customer service environment. § §You have a reliable motor vehicle§ §You can source and manage a small team§ § §  §This is your opportunity to run a small business in a vibrant shopping centre, with minimal investment and excellent financial incentives. You don’t need retail experience but a background in customer service / retail / hospitality is beneficial.§  § §  §If you want to be part of a national retail group with a long history of success, then:§ § §Visit our website §http://www.calendarclub.com.au/be-your-own-boss/§ and read all information provided§ §Submit your Expression On Interest on the website with a brief CV including a 100-word description of why you are awesome§§§§"
50763524,https://www.seek.co.nz/job/50763524,"Pop Up Store Licensee at Westfield Kotara Job in Newcastle, Maitland & Hunter - SEEK","Calendar Club","17 Oct 2020",Contract/Temp,"Newcastle, Maitland & Hunter","Self Employment","Self Employment","","      ","","","TXT/50763524.txt	§Pop Up Store Licensee at Westfield Kotara§§More jobs from this company§§§§§§§§Job Description§§Job Header§§Pop Up Store Licensee at Westfield Kotara§§Advertiser: §Calendar Club§§More jobs from this company§§§§Job Information§§Job Listing Date§§17 Oct 2020§§Location§§Newcastle, Maitland &amp; Hunter§§Salary§§Run Your Own Store &amp; Earn $1,800++ per week§§Work Type§§Contract/Temp§§Classification§§Self Employment§, §Self Employment§§§§§§§§§  §    §    §      §Pop Up Store Licensee at Westfield Kotara §      §        §§        §          §Earn $1,800++ per week &amp; get paid weekly.§          §Operate your own retail store at Westfield Kotara over Christmas, with retail at its peak!§          §Short season (6-10 weeks) – November to January. §          §Opportunities available across Australia &amp; New Zealand§        §        § §        §Calendar Club, the largest and most successful pop up retailer ever, is back again for its 26th consecutive year. We’ve opened over 4,000 stores since 1995 and this year will open 120 stores again across Australia and New Zealand.§        §We only trade over the Christmas period when sales are strongest and mall traffic is highest. This maximises your earning potential. §        §Opportunities are limited so act fast…§        § §        §WHAT WE PROVIDE§        §          §A great site in one of the country's best shopping centres. We pay the rent!§          §All shop fittings, point of sale equipment, stock and other equipment - everything you need to make your store looks fantastic.§          §Training and support to ensure your success.§        §        § §        §YOUR ROLE§        §          §Manage store performance, including the sales budget.§          §Ensure high store presentation and customer service standards.§          §Recruit, train and manage your team.§          §Set up and dismantle your store. §        §        § §        § §REQUIREMENTS§        §          §You are a hardworking, physically active go-getter who thrives in a customer service environment. §          §You have a reliable motor vehicle§          §You can source and manage a small team§        §        § §        §This is your opportunity to run a small business in a vibrant shopping centre, with minimal investment and excellent financial incentives. You don’t need retail experience but a background in customer service / retail / hospitality is beneficial.§        §If you want to be part of a national retail group with a long history of success then please apply now via SEEK or For more information go to: §https://calendarclub.com.au/be-your-own-boss/§      §    §    §  §§§ §Earn $1,800++ per week &amp; get paid weekly.§ §Operate your own retail store at Westfield Kotara over Christmas, with retail at its peak!§ §Short season (6-10 weeks) – November to January. § §Opportunities available across Australia &amp; New Zealand§ § §  §Calendar Club, the largest and most successful pop up retailer ever, is back again for its 26th consecutive year. We’ve opened over 4,000 stores since 1995 and this year will open 120 stores again across Australia and New Zealand.§  §We only trade over the Christmas period when sales are strongest and mall traffic is highest. This maximises your earning potential. §  §Opportunities are limited so act fast…§  § §  §WHAT WE PROVIDE§ § §A great site in one of the country's best shopping centres. We pay the rent!§ §All shop fittings, point of sale equipment, stock and other equipment - everything you need to make your store looks fantastic.§ §Training and support to ensure your success.§ § §  §YOUR ROLE§ § §Manage store performance, including the sales budget.§ §Ensure high store presentation and customer service standards.§ §Recruit, train and manage your team.§ §Set up and dismantle your store. § § §  § §REQUIREMENTS§ § §You are a hardworking, physically active go-getter who thrives in a customer service environment. § §You have a reliable motor vehicle§ §You can source and manage a small team§ § §  §This is your opportunity to run a small business in a vibrant shopping centre, with minimal investment and excellent financial incentives. You don’t need retail experience but a background in customer service / retail / hospitality is beneficial.§  §If you want to be part of a national retail group with a long history of success then please apply now via SEEK or For more information go to: §https://calendarclub.com.au/be-your-own-boss/§§§§"
50770120,https://www.seek.co.nz/job/50770120,"Owner Driver - Subcontractor Job in Melbourne - SEEK","Direct Freight Express","19 Oct 2020",Contract/Temp,"Melbourne, Northern Suburbs","Self Employment","Self Employment","","   ","Be prepared to provide a current licence history report for the previous five years","Which of the following statements best describes your right to work in Australia?","TXT/50770120.txt	§Owner Driver - Subcontractor§§More jobs from this company§§§§§§§§Job Description§§Job Header§§Owner Driver - Subcontractor§§Advertiser: §Direct Freight Express§§More jobs from this company§§§§Job Information§§Job Listing Date§§19 Oct 2020§§Location§§Melbourne§, §Northern Suburbs§§Work Type§§Contract/Temp§§Classification§§Self Employment§, §Self Employment§§§§§§§§§  §    §      §      §        §Owner Driver - Subcontractor §        §          §Our Story:§          §Direct Freight Express is a nationwide family owned &amp; operated Company with over 25 years experience in Road Transport. We currently have over 1700 employees across 50 locations and owe our growth to our dedication to customer focus, innovation and service.§          §The Opportunity:§          §We are currently seeking highly motivated individual to join our team as soon as possible:§          §Role: §Owner Driver / Sub contractor Delivery Driver§          §Location:§ Campbellfield§          §Hours of Work: §approx. 20-30 hours per week§          §The position will include duties such as but will not be limited to:§          §            §Efficiently perform pickups from clients in the North West of metropolitan Melbourne§            §Use of PDA Scanner to record consignment movements§            §Secure load restraints and protect consignments on board§            §Manual handle freight where necessary§            §Safely operate and conduct vehicle checks of your assigned MR/HR Class vehicle§            §Maintain all freight, parcels and documentation.§          §          §About you:§          §            §Minimum MR/HR drivers licence §            §Multi drop exp. in a similar company (minimum 12 months)§            §Own well presented &amp; well maintained 12-14 tonne truck§            §No more than 6 demerit points accumulated on licence§            §Ability to pass a pre-employment medical, including D &amp; A test§            §Be prepared to provide a current licence history report for the previous five years§            §Able to provide at least two employment references§            §Possess public liability &amp; workers compensation insurances. §            §Full permanent working rights.§          §          §Our Benefits:§          §            §Attractive hourly rate§            §Potential long term contract - industry is booming§            §Invoices paid weekly, and on time§          §          §Fit the above criteria or would like to start your career in transport? §APPLY NOW via SEEK!§        §        §        §      §    §  §§§Our Story:§ §Direct Freight Express is a nationwide family owned &amp; operated Company with over 25 years experience in Road Transport. We currently have over 1700 employees across 50 locations and owe our growth to our dedication to customer focus, innovation and service.§ §The Opportunity:§ §We are currently seeking highly motivated individual to join our team as soon as possible:§ §Role: §Owner Driver / Sub contractor Delivery Driver§ §Location:§ Campbellfield§ §Hours of Work: §approx. 20-30 hours per week§ §The position will include duties such as but will not be limited to:§ § §Efficiently perform pickups from clients in the North West of metropolitan Melbourne§ §Use of PDA Scanner to record consignment movements§ §Secure load restraints and protect consignments on board§ §Manual handle freight where necessary§ §Safely operate and conduct vehicle checks of your assigned MR/HR Class vehicle§ §Maintain all freight, parcels and documentation.§ §About you:§ § §Minimum MR/HR drivers licence § §Multi drop exp. in a similar company (minimum 12 months)§ §Own well presented &amp; well maintained 12-14 tonne truck§ §No more than 6 demerit points accumulated on licence§ §Ability to pass a pre-employment medical, including D &amp; A test§ §Be prepared to provide a current licence history report for the previous five years§ §Able to provide at least two employment references§ §Possess public liability &amp; workers compensation insurances. § §Full permanent working rights.§ §Our Benefits:§ § §Attractive hourly rate§ §Potential long term contract - industry is booming§ §Invoices paid weekly, and on time§ §Fit the above criteria or would like to start your career in transport? §APPLY NOW via SEEK!§§§§The application form will include these questions:§§Which of the following statements best describes your right to work in Australia?§How much notice are you required to give your current employer?§Do you have a current Australian driver&#x27;s licence?§HOW MANY YEARS OF DELIVERY DRIVING OR COURIER EXPERIENCE DO YOU HAVE?§HOW MANY DROPS A DAY (MULTI DROP) ARE YOU USED TO COMPLETING?§§§"
50763527,https://www.seek.co.nz/job/50763527,"Manage Your Retail Store at Whitford City Job in Perth - SEEK","Calendar Club","17 Oct 2020",Contract/Temp,"Perth, Northern Suburbs & Joondalup","Self Employment","Self Employment","","      ","","","TXT/50763527.txt	§Manage Your Retail Store at Whitford City§§More jobs from this company§§§§§§§§Job Description§§Job Header§§Manage Your Retail Store at Whitford City§§Advertiser: §Calendar Club§§More jobs from this company§§§§Job Information§§Job Listing Date§§17 Oct 2020§§Location§§Perth§, §Northern Suburbs &amp; Joondalup§§Salary§§Manage your own time &amp; Earn $1,800++ Per Week§§Work Type§§Contract/Temp§§Classification§§Self Employment§, §Self Employment§§§§§§§§§  §    §    §      §Manage Your Retail Store at Whitford City §      §        §§        §          §Manage your own retail store at Whitford City Shopping Centre over Christmas, with retail at its peak!§          §Earn $1,800++ per week &amp; get paid weekly.§          §Short season (6-10 weeks) – November to January.§          §Opportunities available across Australia &amp; New Zealand§        §        § §        §Calendar Club, the largest and most successful pop up retailer ever, is back again for its 26th consecutive year. We’ve opened over 4,000 stores since 1995 and this year will open 120 stores again across Australia and New Zealand.§        §We only trade over the Christmas period when sales are strongest and mall traffic is highest. This maximises your earning potential. §        §Opportunities are limited so act fast…§        § §        §WHAT WE PROVIDE§        §          §A great site in one of the country's best shopping centres. We pay the rent!§          §All shop fittings, point of sale equipment, stock and other equipment - everything you need to make your store looks fantastic.§          §Training and support to ensure your success.§        §        § §        §YOUR ROLE§        §          §Manage store performance, including the sales budget.§          §Ensure high store presentation and customer service standards.§          §Recruit, train and manage your team.§          §Set up and dismantle your store. §        §        § §        § §REQUIREMENTS§        §          §You are a hardworking, physically active go-getter who thrives in a customer service environment. §          §You have a reliable motor vehicle§          §You can source and manage a small team§        §        § §        §This is your opportunity to run a small business in a vibrant shopping centre, with minimal investment and excellent financial incentives. You don’t need retail experience but a background in customer service, hospitality and/or retail is beneficial.§        §If you want to be part of a national retail group with a long history of success then please apply now via SEEK or For more information go to: §https://calendarclub.com.au/be-your-own-boss/§      §    §    §  §§§ §Manage your own retail store at Whitford City Shopping Centre over Christmas, with retail at its peak!§ §Earn $1,800++ per week &amp; get paid weekly.§ §Short season (6-10 weeks) – November to January.§ §Opportunities available across Australia &amp; New Zealand§ § § §Calendar Club, the largest and most successful pop up retailer ever, is back again for its 26th consecutive year. We’ve opened over 4,000 stores since 1995 and this year will open 120 stores again across Australia and New Zealand.§ §We only trade over the Christmas period when sales are strongest and mall traffic is highest. This maximises your earning potential. § §Opportunities are limited so act fast…§ § § §WHAT WE PROVIDE§ § §A great site in one of the country's best shopping centres. We pay the rent!§ §All shop fittings, point of sale equipment, stock and other equipment - everything you need to make your store looks fantastic.§ §Training and support to ensure your success.§ § § §YOUR ROLE§ § §Manage store performance, including the sales budget.§ §Ensure high store presentation and customer service standards.§ §Recruit, train and manage your team.§ §Set up and dismantle your store. § § § § §REQUIREMENTS§ § §You are a hardworking, physically active go-getter who thrives in a customer service environment. § §You have a reliable motor vehicle§ §You can source and manage a small team§ § § §This is your opportunity to run a small business in a vibrant shopping centre, with minimal investment and excellent financial incentives. You don’t need retail experience but a background in customer service, hospitality and/or retail is beneficial.§ §If you want to be part of a national retail group with a long history of success then please apply now via SEEK or For more information go to: §https://calendarclub.com.au/be-your-own-boss/§§§§"
50763526,https://www.seek.co.nz/job/50763526,"Manage Your Retail Store at Indooroopilly Shopping Centre Job in Brisbane - SEEK","Calendar Club","17 Oct 2020",Contract/Temp,"Brisbane, CBD & Inner Suburbs","Self Employment","Self Employment","","       ","","","TXT/50763526.txt	§Manage Your Retail Store at Indooroopilly Shopping Centre§§More jobs from this company§§§§§§§§Job Description§§Job Header§§Manage Your Retail Store at Indooroopilly Shopping Centre§§Advertiser: §Calendar Club§§More jobs from this company§§§§Job Information§§Job Listing Date§§17 Oct 2020§§Location§§Brisbane§, §CBD &amp; Inner Suburbs§§Salary§§Manage your own time &amp; Earn $1,900++ Per Week§§Work Type§§Contract/Temp§§Classification§§Self Employment§, §Self Employment§§§§§§§§§  §    §    §      §Manage Your Retail Store at Indooroopilly Shopping Centre §      §        §§        §          §Manage your own retail store at Indooroopilly Shopping Centre over Christmas, with retail at its peak!§          §Earn $1,900++ per week &amp; get paid weekly.§          §Short season (6-10 weeks) – November to January.§          §Opportunities available across Australia &amp; New Zealand§        §        § §        §Calendar Club, the largest and most successful pop up retailer ever, is back again for its 26th consecutive year. We’ve opened over 4,000 stores since 1995 and this year will open 120 stores again across Australia and New Zealand.§        §We only trade over the Christmas period when sales are strongest and mall traffic is highest. This maximises your earning potential. §        §Opportunities are limited so act fast…§        § §        §WHAT WE PROVIDE§        §          §A great site in one of the country's best shopping centres. We pay the rent!§          §All shop fittings, point of sale equipment, stock and other equipment - everything you need to make your store looks fantastic.§          §Training and support to ensure your success.§        §        § §        §YOUR ROLE§        §          §Manage store performance, including the sales budget.§          §Ensure high store presentation and customer service standards.§          §Recruit, train and manage your team.§          §Set up and dismantle your store. §        §        § §        § §REQUIREMENTS§        §          §You are a hardworking, physically active go-getter who thrives in a customer service environment. §          §You have a reliable motor vehicle§          §You can source and manage a small team§        §        § §        §This is your opportunity to run a small business in a vibrant shopping centre, with minimal investment and excellent financial incentives. You don’t need retail experience but a background in customer service, hospitality and/or retail is beneficial.§        §If you want to be part of a national retail group with a long history of success then please apply now via SEEK or For more information go to: §https://calendarclub.com.au/be-your-own-boss/§      §    §    §  §§§ §Manage your own retail store at Indooroopilly Shopping Centre over Christmas, with retail at its peak!§ §Earn $1,900++ per week &amp; get paid weekly.§ §Short season (6-10 weeks) – November to January.§ §Opportunities available across Australia &amp; New Zealand§ § § §Calendar Club, the largest and most successful pop up retailer ever, is back again for its 26th consecutive year. We’ve opened over 4,000 stores since 1995 and this year will open 120 stores again across Australia and New Zealand.§ §We only trade over the Christmas period when sales are strongest and mall traffic is highest. This maximises your earning potential. § §Opportunities are limited so act fast…§ § § §WHAT WE PROVIDE§ § §A great site in one of the country's best shopping centres. We pay the rent!§ §All shop fittings, point of sale equipment, stock and other equipment - everything you need to make your store looks fantastic.§ §Training and support to ensure your success.§ § § §YOUR ROLE§ § §Manage store performance, including the sales budget.§ §Ensure high store presentation and customer service standards.§ §Recruit, train and manage your team.§ §Set up and dismantle your store. § § § § §REQUIREMENTS§ § §You are a hardworking, physically active go-getter who thrives in a customer service environment. § §You have a reliable motor vehicle§ §You can source and manage a small team§ § § §This is your opportunity to run a small business in a vibrant shopping centre, with minimal investment and excellent financial incentives. You don’t need retail experience but a background in customer service, hospitality and/or retail is beneficial.§ §If you want to be part of a national retail group with a long history of success then please apply now via SEEK or For more information go to: §https://calendarclub.com.au/be-your-own-boss/§§§§"
