jobId,jobUrl,jobTitle,advertiser,listingDate,workType,location,classification,subClassification,email,phone,experience,xenophobe,jobText
50554068,https://www.seek.co.nz/job/50554068,"Pop Up Store Licensee at Riverlink Shopping Centre Job in Brisbane - SEEK","Calendar Club","7 Oct 2020",Contract/Temp,"Brisbane, Western Suburbs & Ipswich","Self Employment","Self Employment","","   ","","","TXT/50702338.txt	§Pop Up Store Licensee at Riverlink Shopping Centre§§More jobs from this company§§§§§§§§Job Description§§Job Header§§Pop Up Store Licensee at Riverlink Shopping Centre§§Advertiser: §Calendar Club§§More jobs from this company§§§§Job Information§§Job Listing Date§§7 Oct 2020§§Location§§Brisbane§, §Western Suburbs &amp; Ipswich§§Salary§§Run Your Own Store &amp; Earn $1,700-$2,000++ per week§§Work Type§§Contract/Temp§§Classification§§Self Employment§, §Self Employment§§§§§§§§§  §    §    §      §Pop Up Store Licensee at Riverlink Shopping Centre §      §        §§        §          §Earn $1,700-$2,000++ per week &amp; get paid weekly.§          §Operate your own retail store at a major shopping centre over Christmas, with retail at its peak!§          §Short season (6-10 weeks) – November to January. §          §Opportunities available across Australia &amp; New Zealand§        §        § §        §Calendar Club, the largest and most successful pop up retailer ever, is back again for its 26th consecutive year. We’ve opened over 4,000 stores since 1995 and this year will open 120 stores again across Australia and New Zealand.§        §We only trade over the Christmas period when sales are strongest and mall traffic is highest. This maximises your earning potential. §        §Opportunities are limited so act fast…§        § §        §WHAT WE PROVIDE§        §          §A great site in one of the country's best shopping centres. We pay the rent!§          §All shop fittings, point of sale equipment, stock and other equipment - everything you need to make your store looks fantastic.§          §Training and support to ensure your success.§        §        § §        §YOUR ROLE§        §          §Manage store performance, including the sales budget.§          §Ensure high store presentation and customer service standards.§          §Recruit, train and manage your team.§          §Set up and dismantle your store. §        §        § §        § §REQUIREMENTS§        §          §You are a hardworking, physically active go-getter who thrives in a customer service environment. §          §You have a reliable motor vehicle§          §You can source and manage a small team§        §        § §        §This is your opportunity to run a small business in a vibrant shopping centre, with minimal investment and excellent financial incentives. You don’t need retail experience but a background in customer service / retail / hospitality is beneficial.§        § §        §If you want to be part of a national retail group with a long history of success, then:§        §          §Visit our website §http://www.calendarclub.com.au/be-your-own-boss/§ and read all information provided§          §Submit your Expression On Interest on the website with a brief CV including a 100-word description of why you are awesome§        §        §ALL APPLICATIONS ARE TO BE SUBMITTED ON CALENDAR CLUB WEBSITE. PLEASE DO NOT EMAIL YOUR APPLICATION.§      §    §    §  §§§ §Earn $1,700-$2,000++ per week &amp; get paid weekly.§ §Operate your own retail store at a major shopping centre over Christmas, with retail at its peak!§ §Short season (6-10 weeks) – November to January. § §Opportunities available across Australia &amp; New Zealand§ § §  §Calendar Club, the largest and most successful pop up retailer ever, is back again for its 26th consecutive year. We’ve opened over 4,000 stores since 1995 and this year will open 120 stores again across Australia and New Zealand.§  §We only trade over the Christmas period when sales are strongest and mall traffic is highest. This maximises your earning potential. §  §Opportunities are limited so act fast…§  § §  §WHAT WE PROVIDE§ § §A great site in one of the country's best shopping centres. We pay the rent!§ §All shop fittings, point of sale equipment, stock and other equipment - everything you need to make your store looks fantastic.§ §Training and support to ensure your success.§ § §  §YOUR ROLE§ § §Manage store performance, including the sales budget.§ §Ensure high store presentation and customer service standards.§ §Recruit, train and manage your team.§ §Set up and dismantle your store. § § §  § §REQUIREMENTS§ § §You are a hardworking, physically active go-getter who thrives in a customer service environment. § §You have a reliable motor vehicle§ §You can source and manage a small team§ § §  §This is your opportunity to run a small business in a vibrant shopping centre, with minimal investment and excellent financial incentives. You don’t need retail experience but a background in customer service / retail / hospitality is beneficial.§  § §  §If you want to be part of a national retail group with a long history of success, then:§ § §Visit our website §http://www.calendarclub.com.au/be-your-own-boss/§ and read all information provided§ §Submit your Expression On Interest on the website with a brief CV including a 100-word description of why you are awesome§ §ALL APPLICATIONS ARE TO BE SUBMITTED ON CALENDAR CLUB WEBSITE. PLEASE DO NOT EMAIL YOUR APPLICATION.§§§§"
50554082,https://www.seek.co.nz/job/50554082,"Pop Up Store Licensee Job in Lismore & Far North Coast - SEEK","Calendar Club","11 Sept 2020",Contract/Temp,"Lismore & Far North Coast","Self Employment","Self Employment","","   ","","","TXT/50554021.txt	§Pop Up Store Licensee§§More jobs from this company§§§§§§§§Job Description§§Job Header§§Pop Up Store Licensee§§Advertiser: §Calendar Club§§More jobs from this company§§§§Job Information§§Job Listing Date§§11 Sept 2020§§Location§§Lismore &amp; Far North Coast§§Salary§§Run Your Own Store &amp; Earn $1,700-$2,000++ per week§§Work Type§§Contract/Temp§§Classification§§Self Employment§, §Self Employment§§§§§§§§§  §    §    §      §Pop Up Store Licensee §      §        §§        §          §Earn $1,700-$2,000++ per week &amp; get paid weekly.§          §Operate your own retail store at a major shopping centre over Christmas, with retail at its peak!§          §Short season (6-10 weeks) – November to January. §          §Opportunities available across Australia &amp; New Zealand§        §        § §        §Calendar Club, the largest and most successful pop up retailer ever, is back again for its 26th consecutive year. We’ve opened over 4,000 stores since 1995 and this year will open 120 stores again across Australia and New Zealand.§        §We only trade over the Christmas period when sales are strongest and mall traffic is highest. This maximises your earning potential. §        §Opportunities are limited so act fast…§        § §        §WHAT WE PROVIDE§        §          §A great site in one of the country's best shopping centres. We pay the rent!§          §All shop fittings, point of sale equipment, stock and other equipment - everything you need to make your store looks fantastic.§          §Training and support to ensure your success.§        §        § §        §YOUR ROLE§        §          §Manage store performance, including the sales budget.§          §Ensure high store presentation and customer service standards.§          §Recruit, train and manage your team.§          §Set up and dismantle your store. §        §        § §        § §REQUIREMENTS§        §          §You are a hardworking, physically active go-getter who thrives in a customer service environment. §          §You have a reliable motor vehicle§          §You can source and manage a small team§        §        § §        §This is your opportunity to run a small business in a vibrant shopping centre, with minimal investment and excellent financial incentives. You don’t need retail experience but a background in customer service / retail / hospitality is beneficial.§        § §        §If you want to be part of a national retail group with a long history of success, then:§        §          §Visit our website §http://www.calendarclub.com.au/be-your-own-boss/§ and read all information provided§          §Submit your Expression On Interest on the website with a brief CV including a 100-word description of why you are awesome§        §        §ALL APPLICATIONS ARE TO BE SUBMITTED ON CALENDAR CLUB WEBSITE. PLEASE DO NOT EMAIL YOUR APPLICATION.§      §    §    §  §§§ §Earn $1,700-$2,000++ per week &amp; get paid weekly.§ §Operate your own retail store at a major shopping centre over Christmas, with retail at its peak!§ §Short season (6-10 weeks) – November to January. § §Opportunities available across Australia &amp; New Zealand§ § §  §Calendar Club, the largest and most successful pop up retailer ever, is back again for its 26th consecutive year. We’ve opened over 4,000 stores since 1995 and this year will open 120 stores again across Australia and New Zealand.§  §We only trade over the Christmas period when sales are strongest and mall traffic is highest. This maximises your earning potential. §  §Opportunities are limited so act fast…§  § §  §WHAT WE PROVIDE§ § §A great site in one of the country's best shopping centres. We pay the rent!§ §All shop fittings, point of sale equipment, stock and other equipment - everything you need to make your store looks fantastic.§ §Training and support to ensure your success.§ § §  §YOUR ROLE§ § §Manage store performance, including the sales budget.§ §Ensure high store presentation and customer service standards.§ §Recruit, train and manage your team.§ §Set up and dismantle your store. § § §  § §REQUIREMENTS§ § §You are a hardworking, physically active go-getter who thrives in a customer service environment. § §You have a reliable motor vehicle§ §You can source and manage a small team§ § §  §This is your opportunity to run a small business in a vibrant shopping centre, with minimal investment and excellent financial incentives. You don’t need retail experience but a background in customer service / retail / hospitality is beneficial.§  § §  §If you want to be part of a national retail group with a long history of success, then:§ § §Visit our website §http://www.calendarclub.com.au/be-your-own-boss/§ and read all information provided§ §Submit your Expression On Interest on the website with a brief CV including a 100-word description of why you are awesome§ §ALL APPLICATIONS ARE TO BE SUBMITTED ON CALENDAR CLUB WEBSITE. PLEASE DO NOT EMAIL YOUR APPLICATION.§§§§"
50702338,https://www.seek.co.nz/job/50702338,"DELIVER SMALL LOCAL PHONE BOOKS Job in Northern QLD - SEEK","PH Global Distribution P/L","10 Sept 2020",Contract/Temp,"Northern QLD","Self Employment","Self Employment","","       ","","","TXT/50544567.txt	§DELIVER SMALL LOCAL PHONE BOOKS§§More jobs from this company§§§§§§§§Job Description§§Job Header§§DELIVER SMALL LOCAL PHONE BOOKS§§Advertiser: §PH Global Distribution P/L§§More jobs from this company§§§§Job Information§§Job Listing Date§§10 Sept 2020§§Location§§Northern QLD§§Work Type§§Contract/Temp§§Classification§§Self Employment§, §Self Employment§§§§§§EARN EASY $$$$ FROM WALKING!!§ §OWN VEHICLE REQUIRED.                                § §All Townsville local areas. §IMMEDIATE START.§PHONE US NOW ON §0419009517§ or §0418994956§§§§§The application form will include these questions:§§Do you have a current Australian driver&#x27;s licence?§Do you own or have regular access to a car?§§§Right to live and work§§You must have the§ right to live and work §in this location to apply for this job.§§§"
50554021,https://www.seek.co.nz/job/50554021,"DELIVER SMALL LOCAL PHONE BOOKS Job in Cairns & Far North - SEEK","PH Global Distribution P/L","10 Sept 2020",Contract/Temp,"Cairns & Far North","Self Employment","Self Employment","","   ","","","TXT/50544544.txt	§DELIVER SMALL LOCAL PHONE BOOKS§§More jobs from this company§§§§§§§§Job Description§§Job Header§§DELIVER SMALL LOCAL PHONE BOOKS§§Advertiser: §PH Global Distribution P/L§§More jobs from this company§§§§Job Information§§Job Listing Date§§10 Sept 2020§§Location§§Cairns &amp; Far North§§Work Type§§Contract/Temp§§Classification§§Self Employment§, §Self Employment§§§§§§EARN EXTRA $$$$ FROM WALKING!!§ §OWN VEHICLE REQUIRED.                                § §Atherton, Mareeba, Malanda, Yungaburra, Herberton, Ravenshoe and Kuranda areas§Immediate Start.§PHONE §0419009517§ or §0418994956§§§§§The application form will include these questions:§§Do you have a current Australian driver&#x27;s licence?§Do you own or have regular access to a car?§§§Right to live and work§§You must have the§ right to live and work §in this location to apply for this job.§§§"
50544567,https://www.seek.co.nz/job/50544567,"DELIVER SMALL LOCAL PHONE BOOKS Job in Cairns & Far North - SEEK","PH Global Distribution P/L","10 Sept 2020",Contract/Temp,"Cairns & Far North","Self Employment","Self Employment","",0418994956,""," right to live and work ","TXT/50544442.txt	§DELIVER SMALL LOCAL PHONE BOOKS§§More jobs from this company§§§§§§§§Job Description§§Job Header§§DELIVER SMALL LOCAL PHONE BOOKS§§Advertiser: §PH Global Distribution P/L§§More jobs from this company§§§§Job Information§§Job Listing Date§§10 Sept 2020§§Location§§Cairns &amp; Far North§§Work Type§§Contract/Temp§§Classification§§Self Employment§, §Self Employment§§§§§§EARN EASY $$$$ FROM WALKING!!§ §OWN VEHICLE REQUIRED.                                § §Innisfail, Babinda, Tully, Ingham, Mission Beach, Forrest Beach, Kurrimine Beach &amp; Cardwell Areas.§ §IMMEDIATE START.§PHONE §0419009517§ or §0418994956§§§§§The application form will include these questions:§§Do you have a current Australian driver&#x27;s licence?§Do you own or have regular access to a car?§§§Right to live and work§§You must have the§ right to live and work §in this location to apply for this job.§§§"
50544544,https://www.seek.co.nz/job/50544544,"","","","","","","","",0418994956,""," right to live and work ",""
50544442,https://www.seek.co.nz/job/50544442,"","","","","","","","",0418994956,""," right to live and work ",""
"",https://www.seek.co.nz/job/,"","","","","","","","","","","",""
50723357,https://www.seek.co.nz/job/50723357,"DELIVER SMALL LOCAL PHONE BOOKS Job in Darwin - SEEK","PH Global Distribution P/L","12 Oct 2020",Contract/Temp,Darwin,"Self Employment","Self Employment","",0418994956,""," right to live and work ","TXT/50723357.txt	§DELIVER SMALL LOCAL PHONE BOOKS§§More jobs from this company§§§§§§§§Job Description§§Job Header§§DELIVER SMALL LOCAL PHONE BOOKS§§Advertiser: §PH Global Distribution P/L§§More jobs from this company§§§§Job Information§§Job Listing Date§§12 Oct 2020§§Location§§Darwin§§Work Type§§Contract/Temp§§Classification§§Self Employment§, §Self Employment§§§§§§EARN EASY $$$$ FROM WALKING!!§ §OWN VEHICLE REQUIRED.                                § §All Darwin Suburbs available plus Batchelor and Katherine AREAS. §IMMEDIATE START.§PHONE §0419009517§ or §0418994956§§§§§The application form will include these questions:§§Do you have a current Australian driver&#x27;s licence?§Do you own or have regular access to a car?§§§Right to live and work§§You must have the§ right to live and work §in this location to apply for this job.§§§"
50723259,https://www.seek.co.nz/job/50723259,"DELIVER SMALL LOCAL PHONE BOOKS Job in Lismore & Far North Coast - SEEK","PH Global Distribution P/L","12 Oct 2020",Contract/Temp,"Lismore & Far North Coast","Self Employment","Self Employment","",0418994956,""," right to live and work ","TXT/50723259.txt	§DELIVER SMALL LOCAL PHONE BOOKS§§More jobs from this company§§§§§§§§Job Description§§Job Header§§DELIVER SMALL LOCAL PHONE BOOKS§§Advertiser: §PH Global Distribution P/L§§More jobs from this company§§§§Job Information§§Job Listing Date§§12 Oct 2020§§Location§§Lismore &amp; Far North Coast§§Work Type§§Contract/Temp§§Classification§§Self Employment§, §Self Employment§§§§§§EARN EASY $$$$ FROM WALKING!!§ §OWN VEHICLE REQUIRED.                                § §BALLINA, LISMORE, BYRON BAY, CASINO, Gonnellabah, Ocean Shores, Evans Head, Kyogle, Lennox Head, Mullumbimby, Nimbin, Broadwater and Alstonville areas.§ §AVAILABLE TO DELIVER NOW!!!!§IMMEDIATE START.§PHONE §0419009517§ or §0418994956§§§§§The application form will include these questions:§§Do you have a current Australian driver&#x27;s licence?§Do you own or have regular access to a car?§§§Right to live and work§§You must have the§ right to live and work §in this location to apply for this job.§§§"
50718722,https://www.seek.co.nz/job/50718722,"Pop Up Store Licensee at Stockland Townsville Job in Northern QLD - SEEK","Calendar Club","10 Oct 2020",Contract/Temp,"Northern QLD","Self Employment","Self Employment","","      ","","","TXT/50718722.txt	§Pop Up Store Licensee at Stockland Townsville§§More jobs from this company§§§§§§§§Job Description§§Job Header§§Pop Up Store Licensee at Stockland Townsville§§Advertiser: §Calendar Club§§More jobs from this company§§§§Job Information§§Job Listing Date§§10 Oct 2020§§Location§§Northern QLD§§Salary§§Run Your Own Store &amp; Earn $1,700++ per week§§Work Type§§Contract/Temp§§Classification§§Self Employment§, §Self Employment§§§§§§§§§  §    §    §      §Pop Up Store Licensee at Stockland Townsville §      §        §§        §          §Earn $1,700++ per week &amp; get paid weekly.§          §Operate your own retail store at a major shopping centre over Christmas, with retail at its peak!§          §Short season (6-10 weeks) – November to January. §          §Opportunities available across Australia &amp; New Zealand§        §        § §        §Calendar Club, the largest and most successful pop up retailer ever, is back again for its 26th consecutive year. We’ve opened over 4,000 stores since 1995 and this year will open 120 stores again across Australia and New Zealand.§        §We only trade over the Christmas period when sales are strongest and mall traffic is highest. This maximises your earning potential. §        §Opportunities are limited so act fast…§        § §        §WHAT WE PROVIDE§        §          §A great site in one of the country's best shopping centres. We pay the rent!§          §All shop fittings, point of sale equipment, stock and other equipment - everything you need to make your store looks fantastic.§          §Training and support to ensure your success.§        §        § §        §YOUR ROLE§        §          §Manage store performance, including the sales budget.§          §Ensure high store presentation and customer service standards.§          §Recruit, train and manage your team.§          §Set up and dismantle your store. §        §        § §        § §REQUIREMENTS§        §          §You are a hardworking, physically active go-getter who thrives in a customer service environment. §          §You have a reliable motor vehicle§          §You can source and manage a small team§        §        § §        §This is your opportunity to run a small business in a vibrant shopping centre, with minimal investment and excellent financial incentives. You don’t need retail experience but a background in customer service / retail / hospitality is beneficial.§        § §        §If you want to be part of a national retail group with a long history of success, then:§        §          §Visit our website §http://www.calendarclub.com.au/be-your-own-boss/§ and read all information provided§          §Submit your Expression On Interest on the website with a brief CV including a 100-word description of why you are awesome§        §        §ALL APPLICATIONS ARE TO BE SUBMITTED ON CALENDAR CLUB WEBSITE. PLEASE DO NOT EMAIL YOUR APPLICATION.§      §    §    §  §§§ §Earn $1,700++ per week &amp; get paid weekly.§ §Operate your own retail store at a major shopping centre over Christmas, with retail at its peak!§ §Short season (6-10 weeks) – November to January. § §Opportunities available across Australia &amp; New Zealand§ § § §Calendar Club, the largest and most successful pop up retailer ever, is back again for its 26th consecutive year. We’ve opened over 4,000 stores since 1995 and this year will open 120 stores again across Australia and New Zealand.§ §We only trade over the Christmas period when sales are strongest and mall traffic is highest. This maximises your earning potential. § §Opportunities are limited so act fast…§ § § §WHAT WE PROVIDE§ § §A great site in one of the country's best shopping centres. We pay the rent!§ §All shop fittings, point of sale equipment, stock and other equipment - everything you need to make your store looks fantastic.§ §Training and support to ensure your success.§ § § §YOUR ROLE§ § §Manage store performance, including the sales budget.§ §Ensure high store presentation and customer service standards.§ §Recruit, train and manage your team.§ §Set up and dismantle your store. § § § § §REQUIREMENTS§ § §You are a hardworking, physically active go-getter who thrives in a customer service environment. § §You have a reliable motor vehicle§ §You can source and manage a small team§ § § §This is your opportunity to run a small business in a vibrant shopping centre, with minimal investment and excellent financial incentives. You don’t need retail experience but a background in customer service / retail / hospitality is beneficial.§ § § §If you want to be part of a national retail group with a long history of success, then:§ § §Visit our website §http://www.calendarclub.com.au/be-your-own-boss/§ and read all information provided§ §Submit your Expression On Interest on the website with a brief CV including a 100-word description of why you are awesome§ §ALL APPLICATIONS ARE TO BE SUBMITTED ON CALENDAR CLUB WEBSITE. PLEASE DO NOT EMAIL YOUR APPLICATION.§§§§"
