jobId,jobUrl,jobTitle,advertiser,listingDate,workType,location,classification,subClassification,email,phone,experience,xenophobe,jobText
50638646,https://www.seek.co.nz/job/50638646,"Pop Up Store Licensee Job in Brisbane - SEEK","Calendar Club","26 Sept 2020",Contract/Temp,"Brisbane, CBD & Inner Suburbs","Self Employment","Self Employment","","   ","","","TXT/50637474.txt	§Pop Up Store Licensee§§More jobs from this company§§§§§§§§Job Description§§Job Header§§Pop Up Store Licensee§§Advertiser: §Calendar Club§§More jobs from this company§§§§Job Information§§Job Listing Date§§26 Sept 2020§§Location§§Brisbane§, §CBD &amp; Inner Suburbs§§Salary§§Run Your Own Store &amp; Earn $1,700-$2,000++ per week§§Work Type§§Contract/Temp§§Classification§§Self Employment§, §Self Employment§§§§§§§§§  §    §    §      §Pop Up Store Licensee §      §        §§        §          §Earn $1,700-$2,000++ per week &amp; get paid weekly.§          §Operate your own retail store at a major shopping centre over Christmas, with retail at its peak!§          §Short season (6-10 weeks) – November to January. §          §Opportunities available across Australia &amp; New Zealand§        §        § §        §Calendar Club, the largest and most successful pop up retailer ever, is back again for its 26th consecutive year. We’ve opened over 4,000 stores since 1995 and this year will open 120 stores again across Australia and New Zealand.§        §We only trade over the Christmas period when sales are strongest and mall traffic is highest. This maximises your earning potential. §        §Opportunities are limited so act fast…§        § §        §WHAT WE PROVIDE§        §          §A great site in one of the country's best shopping centres. We pay the rent!§          §All shop fittings, point of sale equipment, stock and other equipment - everything you need to make your store looks fantastic.§          §Training and support to ensure your success.§        §        § §        §YOUR ROLE§        §          §Manage store performance, including the sales budget.§          §Ensure high store presentation and customer service standards.§          §Recruit, train and manage your team.§          §Set up and dismantle your store. §        §        § §        § §REQUIREMENTS§        §          §You are a hardworking, physically active go-getter who thrives in a customer service environment. §          §You have a reliable motor vehicle§          §You can source and manage a small team§        §        § §        §This is your opportunity to run a small business in a vibrant shopping centre, with minimal investment and excellent financial incentives. You don’t need retail experience but a background in customer service / retail / hospitality is beneficial.§        § §        §If you want to be part of a national retail group with a long history of success, then:§        §          §Visit our website §http://www.calendarclub.com.au/be-your-own-boss/§ and read all information provided§          §Submit your Expression On Interest on the website with a brief CV including a 100-word description of why you are awesome§        §        §ALL APPLICATIONS ARE TO BE SUBMITTED ON CALENDAR CLUB WEBSITE. PLEASE DO NOT EMAIL YOUR APPLICATION.§      §    §    §  §§§ §Earn $1,700-$2,000++ per week &amp; get paid weekly.§ §Operate your own retail store at a major shopping centre over Christmas, with retail at its peak!§ §Short season (6-10 weeks) – November to January. § §Opportunities available across Australia &amp; New Zealand§ § §  §Calendar Club, the largest and most successful pop up retailer ever, is back again for its 26th consecutive year. We’ve opened over 4,000 stores since 1995 and this year will open 120 stores again across Australia and New Zealand.§  §We only trade over the Christmas period when sales are strongest and mall traffic is highest. This maximises your earning potential. §  §Opportunities are limited so act fast…§  § §  §WHAT WE PROVIDE§ § §A great site in one of the country's best shopping centres. We pay the rent!§ §All shop fittings, point of sale equipment, stock and other equipment - everything you need to make your store looks fantastic.§ §Training and support to ensure your success.§ § §  §YOUR ROLE§ § §Manage store performance, including the sales budget.§ §Ensure high store presentation and customer service standards.§ §Recruit, train and manage your team.§ §Set up and dismantle your store. § § §  § §REQUIREMENTS§ § §You are a hardworking, physically active go-getter who thrives in a customer service environment. § §You have a reliable motor vehicle§ §You can source and manage a small team§ § §  §This is your opportunity to run a small business in a vibrant shopping centre, with minimal investment and excellent financial incentives. You don’t need retail experience but a background in customer service / retail / hospitality is beneficial.§  § §  §If you want to be part of a national retail group with a long history of success, then:§ § §Visit our website §http://www.calendarclub.com.au/be-your-own-boss/§ and read all information provided§ §Submit your Expression On Interest on the website with a brief CV including a 100-word description of why you are awesome§ §ALL APPLICATIONS ARE TO BE SUBMITTED ON CALENDAR CLUB WEBSITE. PLEASE DO NOT EMAIL YOUR APPLICATION.§§§§"
50662295,https://www.seek.co.nz/job/50662295,"Pop Up Store Licensee Job in Gold Coast - SEEK","Calendar Club","26 Sept 2020",Contract/Temp,"Gold Coast","Self Employment","Self Employment",hr@fullerton.net.au," (   )","We are the most reputable interpreting and translation company in Australia for many years","","TXT/50637485.txt	§Pop Up Store Licensee§§More jobs from this company§§§§§§§§Job Description§§Job Header§§Pop Up Store Licensee§§Advertiser: §Calendar Club§§More jobs from this company§§§§Job Information§§Job Listing Date§§26 Sept 2020§§Location§§Gold Coast§§Salary§§Run Your Own Store &amp; Earn $1,700-$2,000++ per week§§Work Type§§Contract/Temp§§Classification§§Self Employment§, §Self Employment§§§§§§§§§  §    §    §      §Pop Up Store Licensee §      §        §§        §          §Manage your own retail store at a major shopping centre over Christmas, with retail at its peak!§          §Short season (6-10 weeks) – November to January.§          §Opportunities available across Australia &amp; New Zealand§        §        § §        §Calendar Club, the largest and most successful pop up retailer ever, is back again for its 26th consecutive year. We’ve opened over 4,000 stores since 1995 and this year will open 120 stores again across Australia and New Zealand.§        §We only trade over the Christmas period when sales are strongest and mall traffic is highest. This maximises your earning potential. §        §Opportunities are limited so act fast…§        § §        §WHAT WE PROVIDE§        §          §A great site in one of the country's best shopping centres. We pay the rent!§          §All shop fittings, point of sale equipment, stock and other equipment - everything you need to make your store looks fantastic.§          §Training and support to ensure your success.§        §        § §        §YOUR ROLE§        §          §Manage store performance, including the sales budget.§          §Ensure high store presentation and customer service standards.§          §Recruit, train and manage your team.§          §Set up and dismantle your store. §        §        § §        § §REQUIREMENTS§        §          §You are a hardworking, physically active go-getter who thrives in a customer service environment. §          §You have a reliable motor vehicle§          §You can source and manage a small team§        §        § §        §This is your opportunity to run a small business in a vibrant shopping centre, with minimal investment and excellent financial incentives. You don’t need retail experience but a background in customer service, hospitality and/or retail is beneficial.§        § §        §If you want to be part of a national retail group with a long history of success, then:§        §          §Visit our website §http://www.calendarclub.com.au/be-your-own-boss/§ and read all information provided§          §Submit your Expression On Interest on the website with a brief CV including a 100-word description of why you are awesome§        §        §ALL APPLICATIONS ARE TO BE SUBMITTED ON CALENDAR CLUB WEBSITE. PLEASE DO NOT EMAIL YOUR APPLICATION.§      §    §    §  §§§ §Manage your own retail store at a major shopping centre over Christmas, with retail at its peak!§ §Short season (6-10 weeks) – November to January.§ §Opportunities available across Australia &amp; New Zealand§ § §  §Calendar Club, the largest and most successful pop up retailer ever, is back again for its 26th consecutive year. We’ve opened over 4,000 stores since 1995 and this year will open 120 stores again across Australia and New Zealand.§  §We only trade over the Christmas period when sales are strongest and mall traffic is highest. This maximises your earning potential. §  §Opportunities are limited so act fast…§  § §  §WHAT WE PROVIDE§ § §A great site in one of the country's best shopping centres. We pay the rent!§ §All shop fittings, point of sale equipment, stock and other equipment - everything you need to make your store looks fantastic.§ §Training and support to ensure your success.§ § §  §YOUR ROLE§ § §Manage store performance, including the sales budget.§ §Ensure high store presentation and customer service standards.§ §Recruit, train and manage your team.§ §Set up and dismantle your store. § § §  § §REQUIREMENTS§ § §You are a hardworking, physically active go-getter who thrives in a customer service environment. § §You have a reliable motor vehicle§ §You can source and manage a small team§ § §  §This is your opportunity to run a small business in a vibrant shopping centre, with minimal investment and excellent financial incentives. You don’t need retail experience but a background in customer service, hospitality and/or retail is beneficial.§  § §  §If you want to be part of a national retail group with a long history of success, then:§ § §Visit our website §http://www.calendarclub.com.au/be-your-own-boss/§ and read all information provided§ §Submit your Expression On Interest on the website with a brief CV including a 100-word description of why you are awesome§ §ALL APPLICATIONS ARE TO BE SUBMITTED ON CALENDAR CLUB WEBSITE. PLEASE DO NOT EMAIL YOUR APPLICATION.§§§§"
50637474,https://www.seek.co.nz/job/50637474,"Earn $1,700 - $2,000++ Per Week Job in Melbourne - SEEK","Calendar Club","27 Sept 2020",Contract/Temp,"Melbourne, Bayside & South Eastern Suburbs","Self Employment","Self Employment","","   ","","","TXT/50638645.txt	§Earn $1,700 - $2,000++ Per Week§§More jobs from this company§§§§§§§§Job Description§§Job Header§§Earn $1,700 - $2,000++ Per Week§§Advertiser: §Calendar Club§§More jobs from this company§§§§Job Information§§Job Listing Date§§27 Sept 2020§§Location§§Melbourne§, §Bayside &amp; South Eastern Suburbs§§Salary§§Run Your Own Store &amp; Earn $1,700-$2,000++ per week§§Work Type§§Contract/Temp§§Classification§§Self Employment§, §Self Employment§§§§§§§§§  §    §    §      §Earn $1,700 - $2,000++ Per Week §      §        §§        §          §Earn $1,700-$2,000++ per week &amp; get paid weekly.§          §Operate your own retail store at a major shopping centre over Christmas, with retail at its peak!§          §Short season (6-10 weeks) – November to January. §          §Opportunities available across Australia &amp; New Zealand§        §        § §        §Calendar Club, the largest and most successful pop up retailer ever, is back again for its 26th consecutive year. We’ve opened over 4,000 stores since 1995 and this year will open 120 stores again across Australia and New Zealand.§        §We only trade over the Christmas period when sales are strongest and mall traffic is highest. This maximises your earning potential. §        §Opportunities are limited so act fast…§        § §        §WHAT WE PROVIDE§        §          §A great site in one of the country's best shopping centres. We pay the rent!§          §All shop fittings, point of sale equipment, stock and other equipment - everything you need to make your store looks fantastic.§          §Training and support to ensure your success.§        §        § §        §YOUR ROLE§        §          §Manage store performance, including the sales budget.§          §Ensure high store presentation and customer service standards.§          §Recruit, train and manage your team.§          §Set up and dismantle your store. §        §        § §        § §REQUIREMENTS§        §          §You are a hardworking, physically active go-getter who thrives in a customer service environment. §          §You have a reliable motor vehicle§          §You can source and manage a small team§        §        § §        §This is your opportunity to run a small business in a vibrant shopping centre, with minimal investment and excellent financial incentives. You don’t need retail experience but a background in customer service / retail / hospitality is beneficial.§        § §        §If you want to be part of a national retail group with a long history of success, then:§        §          §Visit our website §http://www.calendarclub.com.au/be-your-own-boss/§ and read all information provided§          §Submit your Expression On Interest on the website with a brief CV including a 100-word description of why you are awesome§        §        §ALL APPLICATIONS ARE TO BE SUBMITTED ON CALENDAR CLUB WEBSITE. PLEASE DO NOT EMAIL YOUR APPLICATION.§      §    §    §  §§§ §Earn $1,700-$2,000++ per week &amp; get paid weekly.§ §Operate your own retail store at a major shopping centre over Christmas, with retail at its peak!§ §Short season (6-10 weeks) – November to January. § §Opportunities available across Australia &amp; New Zealand§ § § §Calendar Club, the largest and most successful pop up retailer ever, is back again for its 26th consecutive year. We’ve opened over 4,000 stores since 1995 and this year will open 120 stores again across Australia and New Zealand.§ §We only trade over the Christmas period when sales are strongest and mall traffic is highest. This maximises your earning potential. § §Opportunities are limited so act fast…§ § § §WHAT WE PROVIDE§ § §A great site in one of the country's best shopping centres. We pay the rent!§ §All shop fittings, point of sale equipment, stock and other equipment - everything you need to make your store looks fantastic.§ §Training and support to ensure your success.§ § § §YOUR ROLE§ § §Manage store performance, including the sales budget.§ §Ensure high store presentation and customer service standards.§ §Recruit, train and manage your team.§ §Set up and dismantle your store. § § § § §REQUIREMENTS§ § §You are a hardworking, physically active go-getter who thrives in a customer service environment. § §You have a reliable motor vehicle§ §You can source and manage a small team§ § § §This is your opportunity to run a small business in a vibrant shopping centre, with minimal investment and excellent financial incentives. You don’t need retail experience but a background in customer service / retail / hospitality is beneficial.§ § § §If you want to be part of a national retail group with a long history of success, then:§ § §Visit our website §http://www.calendarclub.com.au/be-your-own-boss/§ and read all information provided§ §Submit your Expression On Interest on the website with a brief CV including a 100-word description of why you are awesome§ §ALL APPLICATIONS ARE TO BE SUBMITTED ON CALENDAR CLUB WEBSITE. PLEASE DO NOT EMAIL YOUR APPLICATION.§§§§"
50637485,https://www.seek.co.nz/job/50637485,"Pop Up Store Licensee Job in Sydney - SEEK","Calendar Club","26 Sept 2020",Contract/Temp,"Sydney, Parramatta & Western Suburbs","Self Employment","Self Employment","","   ","","","TXT/50637470.txt	§Pop Up Store Licensee§§More jobs from this company§§§§§§§§Job Description§§Job Header§§Pop Up Store Licensee§§Advertiser: §Calendar Club§§More jobs from this company§§§§Job Information§§Job Listing Date§§26 Sept 2020§§Location§§Sydney§, §Parramatta &amp; Western Suburbs§§Salary§§Run Your Own Store &amp; Earn $1,700-$2,000++ per week§§Work Type§§Contract/Temp§§Classification§§Self Employment§, §Self Employment§§§§§§§§§  §    §    §      §Pop Up Store Licensee §      §        §§        §          §Earn $1,700-$2,000++ per week &amp; get paid weekly.§          §Operate your own retail store at a major shopping centre over Christmas, with retail at its peak!§          §Short season (6-10 weeks) – November to January. §          §Opportunities available across Australia &amp; New Zealand§        §        § §        §Calendar Club, the largest and most successful pop up retailer ever, is back again for its 26th consecutive year. We’ve opened over 4,000 stores since 1995 and this year will open 120 stores again across Australia and New Zealand.§        §We only trade over the Christmas period when sales are strongest and mall traffic is highest. This maximises your earning potential. §        §Opportunities are limited so act fast…§        § §        §WHAT WE PROVIDE§        §          §A great site in one of the country's best shopping centres. We pay the rent!§          §All shop fittings, point of sale equipment, stock and other equipment - everything you need to make your store looks fantastic.§          §Training and support to ensure your success.§        §        § §        §YOUR ROLE§        §          §Manage store performance, including the sales budget.§          §Ensure high store presentation and customer service standards.§          §Recruit, train and manage your team.§          §Set up and dismantle your store. §        §        § §        § §REQUIREMENTS§        §          §You are a hardworking, physically active go-getter who thrives in a customer service environment. §          §You have a reliable motor vehicle§          §You can source and manage a small team§        §        § §        §This is your opportunity to run a small business in a vibrant shopping centre, with minimal investment and excellent financial incentives. You don’t need retail experience but a background in customer service / retail / hospitality is beneficial.§        § §        §If you want to be part of a national retail group with a long history of success, then:§        §          §Visit our website §http://www.calendarclub.com.au/be-your-own-boss/§ and read all information provided§          §Submit your Expression On Interest on the website with a brief CV including a 100-word description of why you are awesome§        §        §ALL APPLICATIONS ARE TO BE SUBMITTED ON CALENDAR CLUB WEBSITE. PLEASE DO NOT EMAIL YOUR APPLICATION.§      §    §    §  §§§ §Earn $1,700-$2,000++ per week &amp; get paid weekly.§ §Operate your own retail store at a major shopping centre over Christmas, with retail at its peak!§ §Short season (6-10 weeks) – November to January. § §Opportunities available across Australia &amp; New Zealand§ § §  §Calendar Club, the largest and most successful pop up retailer ever, is back again for its 26th consecutive year. We’ve opened over 4,000 stores since 1995 and this year will open 120 stores again across Australia and New Zealand.§  §We only trade over the Christmas period when sales are strongest and mall traffic is highest. This maximises your earning potential. §  §Opportunities are limited so act fast…§  § §  §WHAT WE PROVIDE§ § §A great site in one of the country's best shopping centres. We pay the rent!§ §All shop fittings, point of sale equipment, stock and other equipment - everything you need to make your store looks fantastic.§ §Training and support to ensure your success.§ § §  §YOUR ROLE§ § §Manage store performance, including the sales budget.§ §Ensure high store presentation and customer service standards.§ §Recruit, train and manage your team.§ §Set up and dismantle your store. § § §  § §REQUIREMENTS§ § §You are a hardworking, physically active go-getter who thrives in a customer service environment. § §You have a reliable motor vehicle§ §You can source and manage a small team§ § §  §This is your opportunity to run a small business in a vibrant shopping centre, with minimal investment and excellent financial incentives. You don’t need retail experience but a background in customer service / retail / hospitality is beneficial.§  § §  §If you want to be part of a national retail group with a long history of success, then:§ § §Visit our website §http://www.calendarclub.com.au/be-your-own-boss/§ and read all information provided§ §Submit your Expression On Interest on the website with a brief CV including a 100-word description of why you are awesome§ §ALL APPLICATIONS ARE TO BE SUBMITTED ON CALENDAR CLUB WEBSITE. PLEASE DO NOT EMAIL YOUR APPLICATION.§§§§"
50638645,https://www.seek.co.nz/job/50638645,"DELIVER SMALL LOCAL PHONE BOOKS Job in Northern QLD - SEEK","PH Global Distribution P/L","1 Oct 2020",Contract/Temp,"Northern QLD","Self Employment","Self Employment",""," 1700  2000++  ","","","TXT/50670968.txt	§DELIVER SMALL LOCAL PHONE BOOKS§§More jobs from this company§§§§§§§§Job Description§§Job Header§§DELIVER SMALL LOCAL PHONE BOOKS§§Advertiser: §PH Global Distribution P/L§§More jobs from this company§§§§Job Information§§Job Listing Date§§1 Oct 2020§§Location§§Northern QLD§§Work Type§§Contract/Temp§§Classification§§Self Employment§, §Self Employment§§§§§§EARN EASY $$$$ FROM WALKING!!§ §OWN VEHICLE REQUIRED.                                § §All Townsville local areas. §IMMEDIATE START.§PHONE §0419009517§ or §0418994956§§§§§The application form will include these questions:§§Do you have a current Australian driver&#x27;s licence?§Do you own or have regular access to a car?§§§Right to live and work§§You must have the§ right to live and work §in this location to apply for this job.§§§"
50637470,https://www.seek.co.nz/job/50637470,"CONTRACT INSTALLER - SHOWER SCREENS, MIRRORS & ROBE DOORS Job in Gold Coast - SEEK","Supreme Shower Screens","16 Sept 2020","Full Time","Gold Coast","Self Employment","Self Employment","","   ","","","TXT/50577760.txt	§CONTRACT INSTALLER - SHOWER SCREENS, MIRRORS &amp; ROBE DOORS§§More jobs from this company§§§§§§§§Job Description§§Job Header§§CONTRACT INSTALLER - SHOWER SCREENS, MIRRORS &amp; ROBE DOORS§§Advertiser: §Supreme Shower Screens§§More jobs from this company§§§§Job Information§§Job Listing Date§§16 Sept 2020§§Location§§Gold Coast§§Work Type§§Full Time§§Classification§§Self Employment§, §Self Employment§§§§§§Supreme Shower Screens requires installers to fit our products to new and existing houses in Brisbane, Gold Coast &amp; Northern NSW.§ § §ANY BUILDING TRADE EXPERIENCE AN ADVANTAGE§ §NO EXPERIENCE NECESSARY§ §TRAINING WILL BE PROVIDED§ §CAN EARN UP TO $3,000.00 PER WEEK§ §Continuous work and generous rates.§ §Must be a PTY LTD Company or Trust§ §Own van and tools required.  § §PLEASE CALL LUKE DIRECT ON §0408 591 790§ §§§§The application form will include these questions:§§Which of the following statements best describes your right to work in Australia?§Do you have a current Police Check (National Police Certificate) for employment?§Do you have a current Australian driver&#x27;s licence?§Do you have an Australian Business Number (ABN)?§§§Right to live and work§§You must have the§ right to live and work §in this location to apply for this job.§§§"
