jobId,jobUrl,jobTitle,advertiser,listingDate,workType,location,classification,subClassification,email,phone,experience,xenophobe,jobText
50632746,https://www.seek.co.nz/job/50632746,"Cataloguing and Digitisation Coordinator Job in Auckland - SEEK","Auckland Museum","25 Sept 2020",Contract/Temp,"Auckland, Auckland Central",Advertising,Other,"","   ","","","TXT/50632746.txt	§Cataloguing and Digitisation Coordinator§§More jobs from this company§§§§§§§§Job Description§§Job Header§§Cataloguing and Digitisation Coordinator§§Advertiser: §Auckland Museum§§More jobs from this company§§§§Job Information§§Job Listing Date§§25 Sept 2020§§Location§§Auckland§, §Auckland Central§§Work Type§§Contract/Temp§§Classification§§Advertising, Arts &amp; Media§, §Other§§§§§§§§§  §    §    §      §Cataloguing and Digitisation Coordinator §      §        §Tāmaki Paenga Hira: Tui tui hono tangata, whenua me te moana.§        §Auckland War Memorial Museum: Connecting through sharing stories of people, lands and seas.§        §Auckland Museum is a much-loved culture and heritage organisation at the heart of Auckland's identity, committed to outstanding management of its world-class collections and the employees and volunteers who tell the Museum's stories. We are Auckland's home of commemoration as well as the country's oldest research institution and a major tourist destination.§        §The Collection Information and Access team is part of the Collections and Research Directorate and is responsible for digital preservation, collections online, delivering our Research Strategy and cross collections imaging and data enrichment. §        §This team has a new vacancy for a fixed term but full-time Cataloguing and Digitisation Coordinator, who will be responsible for the workflow and management of a team of Cataloguing Technicians as part of our new 3-year Digital Access Project. The goal of this project is to enhance the collection information by digitising object records and imaging a selection of objects. The resulting enriched catalogued records will support a wide range of future programmes and research as well as increasing information available through Collections Online. §        §To be successful in this role, you will offer:§        §          §At least two years of staff management or supervision experience in a museum context, along with demonstrated success managing recruitment drives to secure effective team members§          §Experience in setting team workflow and monitoring outputs to ensure project objectives are met, both against the timeframes and quality required§          §Extensive collections database experience, preferably in Vernon CMS§          §Ability to negotiate priorities and communicate outcomes to team members and stakeholders§          §An understanding of the principles and practice of the Treaty of Waitangi and the implications for the work of the museum  §        §        §Closing Date: Sunday, 11 October, 2020 at 5.00pm§        §You must be eligible to currently work in New Zealand to apply for this fixed term position.§        §Auckland Museum offers a rich and fulfilling work life where we embrace diversity and nurture our bicultural capability as demonstrated in our Teu le Va and He Korahi Maori strategies. We also offer a range of great benefits such as flexible work and leave and an award-winning wellbeing programme.§        §This is a great opportunity for someone looking to be part of §a fabulous New Zealand organisation committed to telling our national and Auckland stories, reflecting our unique place in the South Pacific.§        §He Oranga Tangata ka ao  §        §Enriching lives: Inspiring discoveries§      §      §      §    §    §careers.aucklandmuseum.com§    §  §§§Tāmaki Paenga Hira: Tui tui hono tangata, whenua me te moana.§ §Auckland War Memorial Museum: Connecting through sharing stories of people, lands and seas.§ §Auckland Museum is a much-loved culture and heritage organisation at the heart of Auckland's identity, committed to outstanding management of its world-class collections and the employees and volunteers who tell the Museum's stories. We are Auckland's home of commemoration as well as the country's oldest research institution and a major tourist destination.§ §The Collection Information and Access team is part of the Collections and Research Directorate and is responsible for digital preservation, collections online, delivering our Research Strategy and cross collections imaging and data enrichment. § §This team has a new vacancy for a fixed term but full-time Cataloguing and Digitisation Coordinator, who will be responsible for the workflow and management of a team of Cataloguing Technicians as part of our new 3-year Digital Access Project. The goal of this project is to enhance the collection information by digitising object records and imaging a selection of objects. The resulting enriched catalogued records will support a wide range of future programmes and research as well as increasing information available through Collections Online. § §To be successful in this role, you will offer:§ § §At least two years of staff management or supervision experience in a museum context, along with demonstrated success managing recruitment drives to secure effective team members§ §Experience in setting team workflow and monitoring outputs to ensure project objectives are met, both against the timeframes and quality required§ §Extensive collections database experience, preferably in Vernon CMS§ §Ability to negotiate priorities and communicate outcomes to team members and stakeholders§ §An understanding of the principles and practice of the Treaty of Waitangi and the implications for the work of the museum  § §Closing Date: Sunday, 11 October, 2020 at 5.00pm§ §You must be eligible to currently work in New Zealand to apply for this fixed term position.§ §Auckland Museum offers a rich and fulfilling work life where we embrace diversity and nurture our bicultural capability as demonstrated in our Teu le Va and He Korahi Maori strategies. We also offer a range of great benefits such as flexible work and leave and an award-winning wellbeing programme.§ §This is a great opportunity for someone looking to be part of §a fabulous New Zealand organisation committed to telling our national and Auckland stories, reflecting our unique place in the South Pacific.§ §He Oranga Tangata ka ao  § §Enriching lives: Inspiring discoveries§§§§"
50633737,https://www.seek.co.nz/job/50633737,"TV Trader Job in Auckland - SEEK","Try the SEEK app to find your dream job faster.","25 Sept 2020","Full Time","Auckland, Auckland Central",Advertising,"Planning & Buying",""," ","","Which of the following statements best describes your right to work in New Zealand?","TXT/50633737.txt	§TV Trader§§Private Advertiser§§§§§§§§Job Description§§Job Header§§TV Trader§§Private Advertiser§§§§Job Information§§Job Listing Date§§25 Sept 2020§§Location§§Auckland§, §Auckland Central§§Work Type§§Full Time§§Classification§§Advertising, Arts &amp; Media§, §Media Strategy, Planning &amp; Buying§§§§§§Company Description§MBM is one of NZ’s leading strategic media companies with offices in Auckland and Wellington. We work with many of New Zealand’s best known brands and provide our clients with services including cross-channel media strategy and planning, negotiations and media buying, digital campaign management, paid search &amp; SEO, social media, analytics and data science, plus content strategy and production. We have won numerous awards for our work including 2019 IAB Digital Agency of the Year and Beacons Media Agency of the Year (twice). We strive for doing great work and cultivating a supportive, respectful and fun company culture.§Job Description§Working within the Investment team to manage TV trading and buying for a designated portfolio of clients. §You will have:§Strong TV buying expertise and want to take the next step, having already gained a minimum of 2 years’ experience honing your skills in a media agency§Developed a sound understanding of the principles of TV buying and how these are accurately applied to all aspects of campaign implementation§Excellent knowledge of TVMAP, Microsoft Word, Excel and Powerpoint, together with an understanding of the AC Nielsen planning and buying tools§An ability to prioritise workload to ensure delivery is met to the highest standard§Demonstrate excellent interpersonal communication skills§Our offer to you: §A collaborative, fun and rewarding team culture §All the benefits of being part of a global network with a wholeself program, learning &amp; development opportunities, flexible working and an industry leading parental leave policy  §Confidential 24 hour support via our employee assistance programme§Additional Information§Publicis Groupe, believes that our people are our greatest asset. Our people are chosen for their personalities, their ethics and professional qualities without any exclusion, preferential treatment or discrimination. We are proud to be an equal opportunities employer and do not discriminate by reason of age, gender, gender identity, race, sexual orientation, nationality, religion or disability or any other difference. We encourage applications from all qualified individuals and will provide appropriate assistance for candidates with disabilities or special needs throughout the recruitment process upon request. §§§§The application form will include these questions:§§Which of the following statements best describes your right to work in New Zealand?§Which of the following Microsoft Office products are you experienced with?§What&#x27;s your expected annual base salary?§§§"
50638969,https://www.seek.co.nz/job/50638969,"Senior Reporter Job in Marlborough - SEEK",Stuff,"27 Sept 2020","Full Time",Marlborough,Advertising,"Journalism & Writing",""," ",""," right to live and work ","TXT/50638969.txt	§Senior Reporter§§More jobs from this company§§§§§§§§Job Description§§Job Header§§Senior Reporter§§Advertiser: §Stuff§§More jobs from this company§§§§Job Information§§Job Listing Date§§27 Sept 2020§§Location§§Marlborough§§Work Type§§Full Time§§Classification§§Advertising, Arts &amp; Media§, §Journalism &amp; Writing§§§§§§§§§  §    §    §      §Senior Reporter §      §        §Here at Stuff, we are proud to be an independent New Zealand owned and operated media organisation. We're looking for a top-performing Senior Reporter to join our team in Marlborough. That's right, in a matter of weeks, you could be soaking up the sun (unofficially NZ's sunniest region) in the beautiful Blenheim and Marlborough Sounds.§        §To be successful in this role, you will be:§        §          §Hungry to break stories§          §Able to generate unique and compelling story ideas§          §A newsroom leader§          §Committed to editorial excellence§        §        §Key requirements include:§        §          §A journalism qualification§          §A strong portfolio of work§          §A full driver's license§          §The right to work in New Zealand§        §        §Benefits of working with us include:§        §          §Medical insurance§          §Access to an excellent employee assistance programme§          §A generous parental leave policy for any employees that are the primary or secondary carer§          §A strong reward &amp; recognition programme§          §Staff discounts on renowned papers and magazines including NZ House and Garden§        §        §Stuff is a collection of platforms that connect Kiwi communities to the stuff that matters, the stuff they love and the stuff that brings us together, every day. We are proud to be New Zealand-owned and operated, and the country's leading media organisation, connecting with more than 3 million New Zealanders every month.§        §Find out more at: about.stuff.co.nz§        §Think you can do the job? Then apply now and start your journey with Stuff today.§        §Ka oti rānei i a koe tēnei mahi? Kāti, tono mai ināianei kia tīmata ai tō haerenga me Stuff i tēnei rā.§        §Stuff champions inclusion. Be it gender, ethnicity, beliefs, abilities or experiences - we know that diversity brings another lens through which we all learn, connect and grow.§        §E kōkiri nei a Stuff i te whāinga kia whai wāhi ai te katoa. Hāunga te ira, te iwi, ngā whakapono, ngā āheinga, ngā wheako rānei o te tangata - e mōhio nei tātou mā te kanorau e whai tirohanga hou ai, e ako ai, e tūhono ai, e whanake anō ai tātou katoa.§        §As we are committed to creating a workplace that reflects the diverse communities in New Zealand, we will always invite and encourage applications from people of all genders, ethnicities, disabilities and ages. We are committed to providing equal employment opportunities for all.§        §Nā runga i tā mātou ū ki tētahi taiao mahi e whakaatu ana i te kanorau o ngā hapori i Aotearoa, i te ao, i te pō, ka pōhiringia, ka ākina anō ngā tono mahi a te marea whānui, hāunga te ira, te iwi, te hauātanga, te pakeke rānei. E ū nei mātou ki te whai kia wātea ai ā mātou ara whai mahi ki te katoa i runga i te mana taurite.§        §Disclaimer: Stuff does not accept unsolicited agency resumes. Stuff is not responsible for any fees related to unsolicited resumes.§        §§      §      §      §    §    §careers.stuff.co.nz§    §  §§§Here at Stuff, we are proud to be an independent New Zealand owned and operated media organisation. We're looking for a top-performing Senior Reporter to join our team in Marlborough. That's right, in a matter of weeks, you could be soaking up the sun (unofficially NZ's sunniest region) in the beautiful Blenheim and Marlborough Sounds.§To be successful in this role, you will be:§Hungry to break stories§Able to generate unique and compelling story ideas§A newsroom leader§Committed to editorial excellence§Key requirements include:§A journalism qualification§A strong portfolio of work§A full driver's license§The right to work in New Zealand§Benefits of working with us include:§Medical insurance§Access to an excellent employee assistance programme§A generous parental leave policy for any employees that are the primary or secondary carer§A strong reward &amp; recognition programme§Staff discounts on renowned papers and magazines including NZ House and Garden§Stuff is a collection of platforms that connect Kiwi communities to the stuff that matters, the stuff they love and the stuff that brings us together, every day. We are proud to be New Zealand-owned and operated, and the country's leading media organisation, connecting with more than 3 million New Zealanders every month.§Find out more at: about.stuff.co.nz§Think you can do the job? Then apply now and start your journey with Stuff today.§Ka oti rānei i a koe tēnei mahi? Kāti, tono mai ināianei kia tīmata ai tō haerenga me Stuff i tēnei rā.§Stuff champions inclusion. Be it gender, ethnicity, beliefs, abilities or experiences - we know that diversity brings another lens through which we all learn, connect and grow.§E kōkiri nei a Stuff i te whāinga kia whai wāhi ai te katoa. Hāunga te ira, te iwi, ngā whakapono, ngā āheinga, ngā wheako rānei o te tangata - e mōhio nei tātou mā te kanorau e whai tirohanga hou ai, e ako ai, e tūhono ai, e whanake anō ai tātou katoa.§As we are committed to creating a workplace that reflects the diverse communities in New Zealand, we will always invite and encourage applications from people of all genders, ethnicities, disabilities and ages. We are committed to providing equal employment opportunities for all.§Nā runga i tā mātou ū ki tētahi taiao mahi e whakaatu ana i te kanorau o ngā hapori i Aotearoa, i te ao, i te pō, ka pōhiringia, ka ākina anō ngā tono mahi a te marea whānui, hāunga te ira, te iwi, te hauātanga, te pakeke rānei. E ū nei mātou ki te whai kia wātea ai ā mātou ara whai mahi ki te katoa i runga i te mana taurite.§Disclaimer: Stuff does not accept unsolicited agency resumes. Stuff is not responsible for any fees related to unsolicited resumes.§§§§§Right to live and work§§You must have the§ right to live and work §in this location to apply for this job.§§§"
50640374,https://www.seek.co.nz/job/50640374,"Chief Reporter - Gore Job in Southland - SEEK","Allied Press Limited","28 Sept 2020","Full Time","Southland, Rest of Southland",Advertising,"Journalism & Writing","A copy of the position description can be requested from HR at recruitment@alliedpress.co.nz.","   ","","Which of the following statements best describes your right to work in New Zealand?","TXT/50640374.txt	§Chief Reporter - Gore§§More jobs from this company§§§§§§§§§§Job Description§§Job Header§§Chief Reporter - Gore§§Advertiser: §Allied Press Limited§§More jobs from this company§§§§Job Information§§Job Listing Date§§28 Sept 2020§§Location§§Southland§, §Rest of Southland§§Work Type§§Full Time§§Classification§§Advertising, Arts &amp; Media§, §Journalism &amp; Writing§§§§§§Are you an experienced journalist ready for your next career move?§ §The Ensign has a vacancy for a Chief Reporter in Gore. The Ensign is an Allied Press Ltd community newspaper published weekly and delivered to 12,000 homes in Eastern Southland, Northern Southland and West Otago. Allied Press is an independent media group that owns the Otago Daily Times and 19 community titles in the South Island.§ §You will be:§ §- an exceptional journalist with 5-10 years’ experience with proven writing, organisational and leadership skills.§ §- curious and passionate about your local community.§ §- resourceful, efficient and able to work to deadlines.§ §The position covers community news across the district.  Some advertising feature writing is required. Strong photography skills are necessary, and video and website skills are desirable.§ §A clean, full NZ driver’s licence is essential.  Some evening and weekend work will be required.§ §Gore district offers a lifestyle packed with arts, music, fashion, sports, excellent schools, public facilities and outdoor pursuits. Gore is home to the Tussock Country Music Festival, the Hokonui Fashion Show and Southern Field Days.§ §If this sounds like you, please apply by way of CV and a cover letter.§ §Informal inquiries should be directed to Bruce Quirey, Allied Press Communities Editor (§bruce.quirey@alliedpress.co.nz§).§ §A copy of the position description can be requested from HR at recruitment@alliedpress.co.nz.§ §Applications will close on Friday 9 October 2020.§ §All applications will be treated in the strictest confidence.§ §Please note you must have the right to work and live in New Zealand to apply for this role.§ §Disclaimer: Allied Press does not accept unsolicited agency resumes. Allied Press is not responsible for any fees related to unsolicited resumes.§ § §§§§The application form will include these questions:§§Which of the following statements best describes your right to work in New Zealand?§What&#x27;s your expected annual base salary?§Do you have a current New Zealand driver&#x27;s licence?§Have you completed a qualification in journalism?§How many years&#x27; experience do you have as a journalist?§§§"
50640428,https://www.seek.co.nz/job/50640428,"Sports/General Reporter - Gore Job in Southland - SEEK","Allied Press Limited","28 Sept 2020","Full Time","Southland, Rest of Southland",Advertising,"Journalism & Writing",bruce.quirey@alliedpress.co.nz,"   ","","Which of the following statements best describes your right to work in New Zealand?","TXT/50640428.txt	§Sports/General Reporter - Gore§§More jobs from this company§§§§§§§§§§Job Description§§Job Header§§Sports/General Reporter - Gore§§Advertiser: §Allied Press Limited§§More jobs from this company§§§§Job Information§§Job Listing Date§§28 Sept 2020§§Location§§Southland§, §Rest of Southland§§Work Type§§Full Time§§Classification§§Advertising, Arts &amp; Media§, §Journalism &amp; Writing§§§§§§Are you a reporter who’s passionate about news and hungry to forge a career telling your §community’s stories?§ §Allied Press Communities has an exciting opportunity for an ambitious and adaptable reporter to join our team based in Gore.§ §Allied Press Ltd employs more than 450 people permanently across 15 sites in the South Island. We operate on multiple media platforms (print, online, digital) delivering news, information and entertainment through our regional and city publications, including §The Ensign§ in Gore.§ §The ideal applicant will be a self-starter with strong reporting skills and a keen interest in sport and general news. Ideally, you will have experience in newspaper reporting and a passion for story-telling, both in print and online.§ §You will be a hard-working team player with a strong work ethic who is flexible, enthusiastic and able to work quickly and calmly under pressure to deliver stories to deadlines.§ §Familiarity with council and court reporting would be a bonus, as would shorthand, social media skills and having what it takes to tell a story with photos and video.§ § §This role will require some weekend and evening work.§ §You will need a clean NZ driving licence.§ §A relevant journalism qualification or industry experience is a distinct advantage.§ §Applications are by way of CV and covering letter through Seek. A copy of the job description can be requested from HR at §recruitment@alliedpress.co.nz§.  § §Informal inquiries about the role are welcome and should be directed to Bruce Quirey on §bruce.quirey@alliedpress.co.nz§ §Applications close§ Friday, 9 October, 2020.§ §All applications will be treated in the strictest confidence.§ §Please note you must have the right to work in New Zealand to apply for this role.§ §Disclaimer: Allied Press does not accept unsolicited agency resumes. Allied Press is not responsible for any fees related to unsolicited resumes.§§§§The application form will include these questions:§§Which of the following statements best describes your right to work in New Zealand?§What&#x27;s your expected annual base salary?§Do you have a current New Zealand driver&#x27;s licence?§Have you completed a qualification in journalism?§How many years&#x27; experience do you have as a journalist?§§§"
