jobId,jobUrl,jobTitle,advertiser,listingDate,workType,location,classification,subClassification,email,phone,experience,xenophobe,jobText
50674949,https://www.seek.co.nz/job/50674949,"Cultural Communities & Youth Programme Producer Job in Auckland - SEEK","Regional Facilities Auckland (RFA)","2 Oct 2020","Full Time","Auckland, Auckland Central",Advertising,"Programming & Production","For more information and a position description please email  aimee.gifford@aucklandcouncil.govt.nz","     ",""," right to live and work ","TXT/50674949.txt	§Cultural Communities &amp; Youth Programme Producer§§More jobs from this company§§§§§§§§Job Description§§Job Header§§Cultural Communities &amp; Youth Programme Producer§§Advertiser: §Regional Facilities Auckland (RFA)§§More jobs from this company§§§§Job Information§§Job Listing Date§§2 Oct 2020§§Location§§Auckland§, §Auckland Central§§Work Type§§Full Time§§Classification§§Advertising, Arts &amp; Media§, §Programming &amp; Production§§§§§§§§§  §    §    §      §Cultural Communities &amp; Youth Programme Producer §      §        §He angitūtanga: The opportunity §        §Auckland Art Gallery Toi o Tāmaki is a cultural leader in Aotearoa New Zealand. Our purpose is to be a creative catalyst for art and ideas, offering transformational experiences that strengthen and enrich communities. Our vision is to be the home of art for Auckland, its people, and visitors from our internationally recognised award-winning building. Established in 1888, the Gallery holds a pre-eminent collection of New Zealand art and a significant collection of international art presented alongside a dynamic programme of temporary exhibitions, events, and outreach activities.§        §An exciting opportunity has arisen for a Cultural Communities and Youth Programme Producer to join the Auckland Art Gallery Toi o Tāmaki. The role is responsible for the development and delivery of Cultural Communities and Youth based public-programmes, working closely with the brand, curatorial, exhibitions &amp; education teams to provide broad ranging opportunities to learn, experience, share, make and enjoy art. There is a strong strategic focus in Māori, Pacifica, Chinese and LGBTQI audience engagement and works collaboratively with our creative practitioners, gallery assistants, and staff across the gallery to ensure a coordinated approach to the overall programmatic offer.§        §Reporting to the Gallery’s Senior Manager of Operations and Audiences your key purpose will be to deliver programmes for Cultural Communities and Youth, prioritising activity in a strategic way that aligns with the gallery’s broader programme opportunity. Working closely with the programme team, front of house, curatorial, exhibitions, collections, marketing &amp; brand teams, the Programme Producer will grow the gallery’s brand by providing exceptional opportunities to engage cultural audiences with the gallery.§ §He kōrero mōu: About you§You are a passionate educator with extensive experience working with artists and cultural communities to deliver exceptional programmes for diverse audiences.  Ideally you will have experience coordinating the delivery of youth focused art programmes in a public gallery, online or collection-based context, but comparable experience working with community engagement will be recognised. Also holding a degree in visual art, art history, cultural development, curatorship or similar, will be advantageous!  § §You will be an engaging communicator and skilled at connecting diverse audiences with a range of art, from historical to contemporary and you will have an extensive network of contacts with creative practitioners, performers, artists, and educators that you can draw on to deliver programming to your target audiences.§ §You will be able to demonstrate knowledge of the processes of learning and the New Zealand curriculum, with a strong understanding and focus on the requirements of Cultural Communities and Youth.    Naturally you will bring excellent relationship building skills, along with a strong track record of successfully achieving outcomes through working collaboratively within your team. §        §In support of Auckland Art Gallery’s commitment to Te Tiriti o Waitangi you will have or be able to demonstrate a desire to build a strong understanding of our Māori Responsiveness framework to support initiatives and continue to build your own capability and confidence. § §Applicants will demonstrate the following attributes:§•    University degree in teaching or visual art, art history, cultural development or curatorship highly regarded §•    Be effective communicator both verbally and written§•    Proven track record in successfully leading, developing, and producing programmes §•    Experience in using Microsoft Office applications§ §Ngā āhuatanga kei a mātou: What we offer§This is an excellent opportunity to occupy an exciting role in New Zealand's leading visual arts institution. As we recalibrate the ways we connect with audiences in light of COVID-19, this is a time for fresh thinking and innovation. We believe the arts have an important contribution to make to community health and wellbeing. This position and the team are located in the Gallery’s dynamic Brand and Commercial department where you will work alongside gallery assistants, curators and research librarians to create high-quality art experiences for students, their teachers and whānau. § §The role is a permanent, full time role working 40 hours a week Monday to Friday with flexibility and working from home day options available.  § §Note: this position does have a requirement to work on weekends, public holidays and after hours as required. § §For further information on Auckland Art Gallery Toi o Tāmaki, please visit our website:§http://www.aucklandartgallery.com/§ §How to Apply:§Please apply online and provide a cover letter and a Curriculum Vitae and tell us why you’re interested in this opportunity.§ §For more information and a position description please email  aimee.gifford@aucklandcouncil.govt.nz§ §Applications close§ §18th October at 11.59PM§        §Regional Facilities Auckland, a CCO of Auckland Council is an equal opportunity employer (EOE) and we are committed to providing a working environment that embraces and values diversity and inclusion. If you have any support or access requirements, we encourage you to advise us at the time of application to assist you through the recruitment process.§ §Auckland Council is committed to the protection and wellbeing of children.  This role is classified as a Children's Worker role under the Vulnerable Children Act 2014. As such applicants will be required to undergo police vetting prior to commencing employment. Appointment will be subject to a satisfactory police check.§      §      §      §    §    §  §§§He angitūtanga: The opportunity §Auckland Art Gallery Toi o Tāmaki is a cultural leader in Aotearoa New Zealand. Our purpose is to be a creative catalyst for art and ideas, offering transformational experiences that strengthen and enrich communities. Our vision is to be the home of art for Auckland, its people, and visitors from our internationally recognised award-winning building. Established in 1888, the Gallery holds a pre-eminent collection of New Zealand art and a significant collection of international art presented alongside a dynamic programme of temporary exhibitions, events, and outreach activities.§An exciting opportunity has arisen for a Cultural Communities and Youth Programme Producer to join the Auckland Art Gallery Toi o Tāmaki. The role is responsible for the development and delivery of Cultural Communities and Youth based public-programmes, working closely with the brand, curatorial, exhibitions &amp; education teams to provide broad ranging opportunities to learn, experience, share, make and enjoy art. There is a strong strategic focus in Māori, Pacifica, Chinese and LGBTQI audience engagement and works collaboratively with our creative practitioners, gallery assistants, and staff across the gallery to ensure a coordinated approach to the overall programmatic offer.§Reporting to the Gallery’s Senior Manager of Operations and Audiences your key purpose will be to deliver programmes for Cultural Communities and Youth, prioritising activity in a strategic way that aligns with the gallery’s broader programme opportunity. Working closely with the programme team, front of house, curatorial, exhibitions, collections, marketing &amp; brand teams, the Programme Producer will grow the gallery’s brand by providing exceptional opportunities to engage cultural audiences with the gallery.§ §He kōrero mōu: About you§You are a passionate educator with extensive experience working with artists and cultural communities to deliver exceptional programmes for diverse audiences.  Ideally you will have experience coordinating the delivery of youth focused art programmes in a public gallery, online or collection-based context, but comparable experience working with community engagement will be recognised. Also holding a degree in visual art, art history, cultural development, curatorship or similar, will be advantageous!  § §You will be an engaging communicator and skilled at connecting diverse audiences with a range of art, from historical to contemporary and you will have an extensive network of contacts with creative practitioners, performers, artists, and educators that you can draw on to deliver programming to your target audiences.§ §You will be able to demonstrate knowledge of the processes of learning and the New Zealand curriculum, with a strong understanding and focus on the requirements of Cultural Communities and Youth.    Naturally you will bring excellent relationship building skills, along with a strong track record of successfully achieving outcomes through working collaboratively within your team. §In support of Auckland Art Gallery’s commitment to Te Tiriti o Waitangi you will have or be able to demonstrate a desire to build a strong understanding of our Māori Responsiveness framework to support initiatives and continue to build your own capability and confidence. § §Applicants will demonstrate the following attributes:§•    University degree in teaching or visual art, art history, cultural development or curatorship highly regarded §•    Be effective communicator both verbally and written§•    Proven track record in successfully leading, developing, and producing programmes §•    Experience in using Microsoft Office applications§ §Ngā āhuatanga kei a mātou: What we offer§This is an excellent opportunity to occupy an exciting role in New Zealand's leading visual arts institution. As we recalibrate the ways we connect with audiences in light of COVID-19, this is a time for fresh thinking and innovation. We believe the arts have an important contribution to make to community health and wellbeing. This position and the team are located in the Gallery’s dynamic Brand and Commercial department where you will work alongside gallery assistants, curators and research librarians to create high-quality art experiences for students, their teachers and whānau. § §The role is a permanent, full time role working 40 hours a week Monday to Friday with flexibility and working from home day options available.  § §Note: this position does have a requirement to work on weekends, public holidays and after hours as required. § §For further information on Auckland Art Gallery Toi o Tāmaki, please visit our website:§http://www.aucklandartgallery.com/§ §How to Apply:§Please apply online and provide a cover letter and a Curriculum Vitae and tell us why you’re interested in this opportunity.§ §For more information and a position description please email  aimee.gifford@aucklandcouncil.govt.nz§ §Applications close§ §18th October at 11.59PM§Regional Facilities Auckland, a CCO of Auckland Council is an equal opportunity employer (EOE) and we are committed to providing a working environment that embraces and values diversity and inclusion. If you have any support or access requirements, we encourage you to advise us at the time of application to assist you through the recruitment process.§ §Auckland Council is committed to the protection and wellbeing of children.  This role is classified as a Children's Worker role under the Vulnerable Children Act 2014. As such applicants will be required to undergo police vetting prior to commencing employment. Appointment will be subject to a satisfactory police check.§§§§Right to live and work§§You must have the§ right to live and work §in this location to apply for this job.§§§"
50675340,https://www.seek.co.nz/job/50675340,"PICTURE FRAMER Job in Auckland - SEEK",NetYourJob,"2 Oct 2020","Full Time","Auckland, Auckland Central",Advertising,Photography,""," ",""," right to live and work ","TXT/50675340.txt	§PICTURE FRAMER§§More jobs from this company§§§§§§§§§§Job Description§§Job Header§§PICTURE FRAMER§§Advertiser: §NetYourJob§§More jobs from this company§§§§Job Information§§Job Listing Date§§2 Oct 2020§§Location§§Auckland§, §Auckland Central§§Work Type§§Full Time§§Classification§§Advertising, Arts &amp; Media§, §Photography§§§§§§Please Quote Reference Number 77391§§Do you have an artistic eye?§Proven framing or photographic experience?§Strong written and communication skills?§PCL Imaging is a professional photographic and digital imaging lab located in central Auckland.§We are committed to delivering excellence to our customers in all facets of our work and have been involved in this great industry for 48 years.§You will need experience in the creative and exacting art of picture framing and its many diverse aspects. You will also need to have outstanding practical and methodical skills along with excellent attention to detail. §A keen, artistic eye is essential along with experience working in a busy workshop environment. §Good written and communication skills are required.§You will learn all aspects of our business as part of your job will also be front counter and reception work including liaising with our clients.§This is a fast paced environment where no two days are the same. You will be working with a team of creatives, sometimes under a tight deadline, so the ability to multitask and use your initiative are important to this role. §If you have the combination of framing experience and dedication that we are looking for we would love to hear from you.§APPLY NOW through the form below.§PCL Imaging Limited§§§§The application form will include these questions:§§Which of the following statements best describes your right to work in New Zealand?§How would you rate your English language skills?§Do you have professional experience as a framer? (Please answer YES or NO)§Have you worked in a workshop environment previously? (Please answer YES or NO)§§§Right to live and work§§You must have the§ right to live and work §in this location to apply for this job.§§§"
50676489,https://www.seek.co.nz/job/50676489,"Exhibitions Manager Job in Auckland - SEEK","Museum of Transport & Technology","2 Oct 2020","Full Time","Auckland, Auckland Central",Advertising,Management,""," ","","Which of the following statements best describes your right to work in New Zealand?","TXT/50676489.txt	§Exhibitions Manager§§More jobs from this company§§§§§§§§Job Description§§Job Header§§Exhibitions Manager§§Advertiser: §Museum of Transport &amp; Technology§§More jobs from this company§§§§Job Information§§Job Listing Date§§2 Oct 2020§§Location§§Auckland§, §Auckland Central§§Work Type§§Full Time§§Classification§§Advertising, Arts &amp; Media§, §Management§§§§§§§§§  §    §    §      §Exhibitions Manager §      §        §MOTAT is an interactive museum with a focus on creating a fun, visually stimulating environment for its visitors, especially children, families and education groups.  It is home to a unique mix of collections and experiences and our vision is to educate and inspire the innovators of tomorrow.§        §One way we do this is by creating exhibitions and experiences that bring science, technology, engineering, arts and mathematics (STEAM) to life alongside our heritage collections and innovations from New Zealand’s current leaders in these fields.§        §As Exhibitions Manager, you will manage and lead our award-winning Exhibitions Team in the continual development and delivery of a complex programme of exhibitions that embody MOTAT’s vision. This is an exciting time as we also aspire to enhance the te ao Māori lens through which our exhibitions can be developed, to engage and grow our Museum audiences.§        §Responsible for the development of temporary, long-term and touring exhibitions, you will play a central role in ensuring that the MOTAT visitor experience is aligned with the vision, audience and collection.§        §Skills and Experience§        §Successful candidates for the role will bring a minimum of 5 years’ experience in exhibition development and delivery. You will have proven management and leadership experience with high-performing teams, gained through a museum or visitor attraction environment, including responsibility for the achievement of vision through creative concept development, programme and budget. Ideal candidates will also have demonstrated understanding of matauranga Māori and experience incorporating both te ao Māori and te reo Māori into the development of visitor experiences.§        §This is a full-time, Monday to Friday role and you must be eligible to work in New Zealand to apply.§        §Along with joining a team of passionate people, you will also get the benefit of flexible working hours and a day off on your birthday, increased Kiwisaver contributions, as well as a MOTAT annual pass for you and your family.§        §Applications close on§ §25 October 2020§        § §        §To view the full position description and to apply§        §GO TO: www.motat.bamboohr.com/jobs§      §      §      §    §    §  §§§MOTAT is an interactive museum with a focus on creating a fun, visually stimulating environment for its visitors, especially children, families and education groups.  It is home to a unique mix of collections and experiences and our vision is to educate and inspire the innovators of tomorrow.§  §One way we do this is by creating exhibitions and experiences that bring science, technology, engineering, arts and mathematics (STEAM) to life alongside our heritage collections and innovations from New Zealand’s current leaders in these fields.§  §As Exhibitions Manager, you will manage and lead our award-winning Exhibitions Team in the continual development and delivery of a complex programme of exhibitions that embody MOTAT’s vision. This is an exciting time as we also aspire to enhance the te ao Māori lens through which our exhibitions can be developed, to engage and grow our Museum audiences.§  §Responsible for the development of temporary, long-term and touring exhibitions, you will play a central role in ensuring that the MOTAT visitor experience is aligned with the vision, audience and collection.§  §Skills and Experience§  §Successful candidates for the role will bring a minimum of 5 years’ experience in exhibition development and delivery. You will have proven management and leadership experience with high-performing teams, gained through a museum or visitor attraction environment, including responsibility for the achievement of vision through creative concept development, programme and budget. Ideal candidates will also have demonstrated understanding of matauranga Māori and experience incorporating both te ao Māori and te reo Māori into the development of visitor experiences.§  §This is a full-time, Monday to Friday role and you must be eligible to work in New Zealand to apply.§  §Along with joining a team of passionate people, you will also get the benefit of flexible working hours and a day off on your birthday, increased Kiwisaver contributions, as well as a MOTAT annual pass for you and your family.§  §Applications close on§ §25 October 2020§  § §  §To view the full position description and to apply§  §GO TO: www.motat.bamboohr.com/jobs§§§§The application form will include these questions:§§Which of the following statements best describes your right to work in New Zealand?§§§"
50680001,https://www.seek.co.nz/job/50680001,"Contractor - Retail Media Distribution Job in Auckland - SEEK","Phantom Billstickers Ltd","4 Oct 2020",Contract/Temp,"Auckland, Auckland Central",Advertising,Promotions,"","    ","","Which of the following statements best describes your right to work in New Zealand?","TXT/50680001.txt	§Contractor - Retail Media Distribution§§More jobs from this company§§§§§§§§Job Description§§Job Header§§Contractor - Retail Media Distribution§§Advertiser: §Phantom Billstickers Ltd§§More jobs from this company§§§§Job Information§§Job Listing Date§§4 Oct 2020§§Location§§Auckland§, §Auckland Central§§Work Type§§Contract/Temp§§Classification§§Advertising, Arts &amp; Media§, §Promotions§§§§§§We are currently looking for eager, motivated people to take on Service Contracts for Auckland Out of Home (OOH) network, delivering on the distribution of posters, flyers, programmes, and other promotional materials into retail spaces for a wide range of clientele, both commercial and arts-based. Campaigns are booked into our system on a weekly cycle, so there is a constant flow of work. Our contractors have an earning potential of $1,200+ per week.§  § §  §The key purpose of this contract is to fulfil the distribution of promotional campaigns into retail spaces across Auckland, reporting on that fulfilment through App-based reporting, and being responsible for the general quality of presentation of sites.§  §Contractors would be required to provide their own vehicle and tools, including a reliable vehicle and an Android phone would be required for the app-based reporting of completed work.§  § §  §We have a dedicated Sales team working to fill our territories with campaigns each week, so there’s none of the stress of chasing down new work while getting your existing workload completed.§The perfect opportunity for someone who loves being their own boss, working outdoors, a physical workload, and being in the know about what’s going on in their neck of the woods.§  §Applicants must hold a full clean New Zealand Driver License and a resident visa or citizenship.§§§§The application form will include these questions:§§Which of the following statements best describes your right to work in New Zealand?§Do you have a current New Zealand driver&#x27;s licence?§How much notice are you required to give your current employer?§Do you own or have regular access to a car?§§§"
50680331,https://www.seek.co.nz/job/50680331,"Fixed Term Contract Promotional Staff Job in Canterbury - SEEK","Try the SEEK app to find your dream job faster.","4 Oct 2020",Contract/Temp,"Canterbury, Christchurch",Advertising,Promotions,"","    ","","Which of the following statements best describes your right to work in New Zealand?","TXT/50680331.txt	§Fixed Term Contract Promotional Staff§§Private Advertiser§§§§§§§§Job Description§§Job Header§§Fixed Term Contract Promotional Staff§§Private Advertiser§§§§Job Information§§Job Listing Date§§4 Oct 2020§§Location§§Canterbury§, §Christchurch§§Salary§§$20 - $24.99 per hour§§Work Type§§Contract/Temp§§Classification§§Advertising, Arts &amp; Media§, §Promotions§§§§§§We are currently hiring for enthusiastic ambassadors for a well known retail chain in Christchurch.§ §PLEASE NOTE: This is short term contractor work of 3 weeks over Oct/Nov.§ §As a successful candidate you will be assisting with raising brand awareness by engaging with customers and promoting with incentives.§ §You will be required to communicate key messages to consumers, track customer feedback, represent the brand in a positive light and convert conversations to sales.§ §To be successful in this role - you will have excellent communication, be computer literate, and be available during the day on Thursday, Friday, Saturday and Sunday in October. You are required to have reliable transport, take pride in your appearance and work ethic.§ §If you are interested in this contractor short term role, please apply NOW with an outline on your personality and willingness to talk to people. § §Applicants for this position should have NZ residency or a valid NZ work visa.§§§§The application form will include these questions:§§Which of the following statements best describes your right to work in New Zealand?§§§"
