jobId,jobUrl,jobTitle,advertiser,listingDate,workType,location,classification,subClassification,email,phone,experience,xenophobe,jobText
50599551,https://www.seek.co.nz/job/50599551,"Project Manager in Nelson, New Zealand Job in Tasman - SEEK",Lucid,"21 Sept 2020","Full Time","Tasman, Nelson",Advertising,Management,"","     ","Experienced in project management with at least a couple of years"," right to live and work ","TXT/50599551.txt	§Project Manager in Nelson, New Zealand§§More jobs from this company§§§§§§§§§§Job Description§§Job Header§§Project Manager in Nelson, New Zealand§§Advertiser: §Lucid§§More jobs from this company§§§§Job Information§§Job Listing Date§§21 Sept 2020§§Location§§Tasman§, §Nelson§§Work Type§§Full Time§§Classification§§Advertising, Arts &amp; Media§, §Management§§§§§§We are looking for an experienced Project Manager with a background in ecommerce to join our team. The project management role is critical for our success. Your primary goal is to ensure that projects are completed successfully, within scope and budget.§You will keep the team running as efficiently and effectively as possible. You will have an understanding of the team's daily, weekly, and monthly work and capacity. You will work with both our New Zealand and New York PM's and production teams.§You will be the primary contact for clients.§§This might be a good fit for you if you have...§A love for your work§A passion for learning and constant improvement§A nerdy obsession with delivering exceptional work within the parameters of the requirements§Pragmatism and the ability to always seek the simplest and most elegant solution to often complex problems§Ability to juggle multiple balls and priorities and to work well under pressure§A genuine desire to add value to the team—in the work you deliver and in how you show leadership to others§Ability to balance speed and efficiency with delivering quality§A thirst for staying up to date with the latest project management trends and best-practices§A continual drive to be an expert in ecommerce§Punctuality, commitment deadlines, and strong self-organisational processes§Ability to decipher complex and murky requirements and scope out and propose practical solutions§Responsibilities§Setting up and defining project scopes and objectives§Translate quotes into project plans and business requirements§Gathering and organising all relevant content from clients§Translating client needs into tasks for the team§Managing projects and tasks in our project management system (ClickUp)§Supporting or leading the team on client calls, capturing notes and follow-ups§Ensure that all projects are delivered on-time, within scope and within budget§Manage the relationship with the client and all stakeholders§Create and maintain comprehensive project documentation§§Requirements§§Must be proactive, willing to jump in and support the team§Comfortable working through murky project requirements and demystifying them into attainable goals§Experienced in project management with at least a couple of years in a similar role§Excellent client-facing and internal communication skills§Excellent written and verbal communication§Relentless attention to detail§Strong working knowledge of project management tools (Asana, ClickUp, Jira, etc.)§ecommerce experience (Shopify preferred)§Agency experience§§Benefits§§Competitive compensation and KiwiSaver contributions§Fun, creative, collaborative team environment in a vibrant co-working space§Opportunities to travel and attend events§Opportunities to work from home§§§§Right to live and work§§You must have the§ right to live and work §in this location to apply for this job.§§§"
50600242,https://www.seek.co.nz/job/50600242,"FCB Media - Senior Strategy Director Job in Auckland - SEEK",FCB,"21 Sept 2020","Full Time","Auckland, Auckland Central",Advertising,"Planning & Buying","","     ","Minimum 6 years","Which of the following statements best describes your right to work in New Zealand?","TXT/50600242.txt	§FCB Media - Senior Strategy Director§§More jobs from this company§§§§§§§§Job Description§§Job Header§§FCB Media - Senior Strategy Director§§Advertiser: §FCB§§More jobs from this company§§§§Job Information§§Job Listing Date§§21 Sept 2020§§Location§§Auckland§, §Auckland Central§§Work Type§§Full Time§§Classification§§Advertising, Arts &amp; Media§, §Media Strategy, Planning &amp; Buying§§§§§§§§§  §    §    §      §FCB Media - Senior Strategy Director §      §We're on the hunt for for a Senior Strategist who shares our ambition for great work to join the team.§Key responsibilities will include: §        §          §Strategic lead and/or strategic consult across a varied portfolio, including commercial and government clients§          §Turning data into actionable insight, from a range of sources across the customer journey§          §Strategic comm’s frameworks to provide focus and innovation springboards for media planning teams§          §Ideation consultation§          §Helping drive understanding and use of FCB Media and Mediabrands strategic IP§          §Thought leadership and sharing creative media inspiration  §          §Championing a balance of science and creativity to deliver stand out, effective comm’s solutions§        §   §About you:§        §          §Minimum 6 years of media planning/strategic experience§          §Demonstrated contribution to award winning/market leading work§          §Articulate writer, storyteller and confident presenter§          §Curious about human behaviour and open to a range of communication philosophies to champion whats right for each client§          §Collaborative skills to work in strategic partnership with business leads, specialists and creative partners§          §Interest in data and tech innovation, and practical application§        §   §About FCB Media:§        §          §One of the most awarded media agencies in Australasia§          §Part of the IPG Mediabrands network. Representing UM in the NZ market, a network of 100 offices across the globe championing Better Science, Better Art, Better Outcomes for clients§          §We’re uniquely placed to offer the best of both worlds - part media agency, part creative agency, part commercial client focus, part government social good§          §Encompassing a range of specialists all under one roof for connected consumer experiences, including one of the largest in-house agency data and tech teams in the market§          §A people focussed, inclusive culture, with a range of wellness, health benefits and training opportunities§          §Flexible working options enable us to be open to full time or part time applicants for the right fit and capabilities. Based in our centrally located Freeman’s Bay, Auckland office, but also supports our awesome Wellington office§        § §Keen to Apply? § We’d love to hear from you! Please apply with your CV and a brief cover letter answering our standard screening questions.  Please provide details of conditions if you are on a visa.§      §      §      §    §    §  §§§We're on the hunt for for a Senior Strategist who shares our ambition for great work to join the team.§Key responsibilities will include: § § §Strategic lead and/or strategic consult across a varied portfolio, including commercial and government clients§ §Turning data into actionable insight, from a range of sources across the customer journey§ §Strategic comm’s frameworks to provide focus and innovation springboards for media planning teams§ §Ideation consultation§ §Helping drive understanding and use of FCB Media and Mediabrands strategic IP§ §Thought leadership and sharing creative media inspiration  § §Championing a balance of science and creativity to deliver stand out, effective comm’s solutions§ §   §About you:§ § §Minimum 6 years of media planning/strategic experience§ §Demonstrated contribution to award winning/market leading work§ §Articulate writer, storyteller and confident presenter§ §Curious about human behaviour and open to a range of communication philosophies to champion whats right for each client§ §Collaborative skills to work in strategic partnership with business leads, specialists and creative partners§ §Interest in data and tech innovation, and practical application§ §   §About FCB Media:§ § §One of the most awarded media agencies in Australasia§ §Part of the IPG Mediabrands network. Representing UM in the NZ market, a network of 100 offices across the globe championing Better Science, Better Art, Better Outcomes for clients§ §We’re uniquely placed to offer the best of both worlds - part media agency, part creative agency, part commercial client focus, part government social good§ §Encompassing a range of specialists all under one roof for connected consumer experiences, including one of the largest in-house agency data and tech teams in the market§ §A people focussed, inclusive culture, with a range of wellness, health benefits and training opportunities§ §Flexible working options enable us to be open to full time or part time applicants for the right fit and capabilities. Based in our centrally located Freeman’s Bay, Auckland office, but also supports our awesome Wellington office§ § §Keen to Apply? § We’d love to hear from you! Please apply with your CV and a brief cover letter answering our standard screening questions.  Please provide details of conditions if you are on a visa.§§§§The application form will include these questions:§§What&#x27;s your expected annual base salary?§How much notice are you required to give your current employer?§Which of the following statements best describes your right to work in New Zealand?§§§"
50601146,https://www.seek.co.nz/job/50601146,"Strategic Communications Advisor Job in Auckland - SEEK","Mana Recruitment","21 Sept 2020","Part Time","Auckland, Auckland Central",Advertising,"Journalism & Writing","To apply, send a cover letter and your updated CV to tiare@manarecruitment.co.nz now or for more information, call ","  ","5+ years","Which of the following statements best describes your right to work in New Zealand?","TXT/50601146.txt	§Strategic Communications Advisor§§More jobs from this company§§§§§§§§§§Job Description§§Job Header§§Strategic Communications Advisor§§Advertiser: §Mana Recruitment§§More jobs from this company§§§§Job Information§§Job Listing Date§§21 Sept 2020§§Location§§Auckland§, §Auckland Central§§Work Type§§Part Time§§Classification§§Advertising, Arts &amp; Media§, §Journalism &amp; Writing§§§§§§Strategic Communications Advisor§ § §Media savvy with great networks?§ §Permanent part time, 2-3 days a week/16-24 hours per week.§ §Now is the time to let your creative side come alive! Hugely exciting position within the Pacific art and events community, joining an innovative and passionate organisation where breaking new ground and inspiring communities is the legacy for generations to come.§ §Internationally acknowledged for their work with Oceanic creatives, cultural organisations, curators and educational providers, Tautai Contemporary Pacific Arts Trust exists to champion contemporary Pacific arts.  As an organisation dedicated to the development and ongoing guidance of Pacific artists, the name Tautai draws on the Samoan word for navigator, reflecting the organisation’s desire to work alongside artists in enhancing their art practice and taking their ideas to the world.§ §Responsible for establishing a comprehensive media network, you will relish utilising your established industry knowledge to maintain and further enhance professional relationships with key media organisations. Adopting various strategies across mainstream, social and viral media and across niche art and cultural networks, you will develop and post content, measuring reach and fit to the organisational brief.§ §Promoting to a diverse audience, you will be working across many diverse groups within the arts and culture genre. Knowledge of Pacific values will be an asset and a desire to work within and for these communities is essential.§ §Skills, knowledge, and experience required for application are to include:§ § §5+ years of experience as a communications specialist, journalist, or the like.§ §A team player committed to organisational success.§ §Skilled in the preparation of a range of materials; press releases, articles and online writing skills for social media posting and publicity for organisational events.§ §Strong communication skills - able to “cold call” media and pitch story ideas.§ §Excellent social media skills.§ §Have experience with events, event sponsors and patrons.§ §Strong relationship management skills.§ §Excellent writing skills.§ §A sense of humour and driven to make a real difference.§ §A formal journalism/communications qualification is desirable but not mandatory to application.§ §Developing and placing stories and content with media on a proactive and targeted basis, you will be well experienced in working to KPI’s within timeframes and to deadlines. Drafting short, practical communications plans with regular media updates and story ideas, you will have the skill to timetable and roll out of communications initiatives within a 12-month strategy plan.  Adept with pitching story ideas and content across a range of media providers, picking up the phone and engaging with others will come naturally to you.§ §You will be able to accept, and seek direction, you will have the confidence to engage with a broad range of people, expertly adapting your style to meet you stakeholder and audience needs.§ §To apply, send a cover letter and your updated CV to tiare@manarecruitment.co.nz now or for more information, call §(09) 632 1108§.§ §Applications Close: Monday 19th October 2020 at 5pm.§§§§The application form will include these questions:§§Which of the following statements best describes your right to work in New Zealand?§§§"
50601167,https://www.seek.co.nz/job/50601167,"Programmes Manager Job in Auckland - SEEK","Mana Recruitment","21 Sept 2020","Part Time","Auckland, Auckland Central",Advertising,"Event Management","To apply, send a cover letter and your updated CV to tiare@manarecruitment.co.nz now or for more information, call "," ","","Which of the following statements best describes your right to work in New Zealand?","TXT/50601167.txt	§Programmes Manager§§More jobs from this company§§§§§§§§§§Job Description§§Job Header§§Programmes Manager§§Advertiser: §Mana Recruitment§§More jobs from this company§§§§Job Information§§Job Listing Date§§21 Sept 2020§§Location§§Auckland§, §Auckland Central§§Work Type§§Part Time§§Classification§§Advertising, Arts &amp; Media§, §Event Management§§§§§§Programmes Manager§ § §Creative and inspiring environment.§ §Quality management with a commitment to continuous improvement.§ §Extensive administration and project management skill set.§ §Permanent 4 days a week/ 32 hours.§ §Understanding and affinity within the Pacific arts community in New Zealand. Join an organisation that holds innovation, culture, and joy at the core of all its does.§ §Internationally acknowledged for their work with Oceanic creatives, cultural organisations, curators and educational providers, Tautai Contemporary Pacific Arts Trust exists to champion contemporary Pacific arts. As an organisation dedicated to the development and ongoing guidance of Pacific artists, the name Tautai draws on the Samoan word for navigator, reflecting the organisation’s desire to work alongside artists in enhancing their art practice and taking their ideas to the world.§ §A unique opportunity has now come to market, which will excite those who are passionate and knowledgeable about the Pacific arts community in New Zealand. As the Programmes Manager you will support the Director of Tautai by managing the effective delivery of events, activities and initiatives within the annual programme. Responsible for developing and updating Tautai’s programmes-related processes and systems, leading evaluation and ensuring accurate records are kept, will require you to have an established skill set within events or marketing supported by a high level of administration ability. Some research and development is also included in the role so you must have a passion for innovation.§ §Taking the lead on specific programming and event delivery within the Tautai annual programme of events and activities, you will record and file all event information and assist with report writing and convene and manage relevant Board meetings. Coordinating and reporting on the outcome of a periodic review of projects, your effective project management skills will see you establishing, sustaining and growing effective relationships with programme and sector partners. Your collaborative approach to identifying the best outcomes for the organisation will have been gained in a comparable position, one in which you have had exposure to the world of Pacific arts and the creative individuals who operate within it.§ §Applicants for this position will be able to demonstrate;§ § §A real and personal passion for contemporary Pacific arts.§ §A team player committed to organisational success.§ §People or team leadership experience.§ §Events management, delivery and subsequent evaluation.§ §Excellent writing skills.§ §Quality management and continuous improvement skills.§ §Effective project management skills.§ §Excellent communication skills, the ability to build rapport and grow relationships.§ §Meeting coordination, support and organisation experience to Executive/Board level.§ §The ability to proactively seek out, develop and maintain effective relationships and networks.§ §A proven administration skill set, with high capability across the Microsoft suite of programmes.§ §Ability to develop tools and templates.§ §The capability to self-manage and self-motivate.§ §This position necessitates creative and focused thinking and a strong ability to work collaboratively with other stakeholders, internal and external to the Trust. This broad ranging position is absolutely core to organisational success, and the success of specialist projects positioned locally and at times globally.§ §Initiating, reviewing and monitoring the effectiveness of organisational systems and processes; you will work across systems in procurement, contracting, project management storage and archiving.§ §Your well-developed people skills will compliment your natural ability to lead, taking others on the journey with you, supporting, mentoring and developing others to be the best that they can be.§ §To apply, send a cover letter and your updated CV to tiare@manarecruitment.co.nz now or for more information, call §(09) 632 1108§.§ §Applications Close: Monday 19th October 2020 at 5pm.§§§§The application form will include these questions:§§Which of the following statements best describes your right to work in New Zealand?§§§"
50601231,https://www.seek.co.nz/job/50601231,"Summer Studentship Opportunities Job in Auckland - SEEK","Auckland Museum","21 Sept 2020",Contract/Temp,"Auckland, Auckland Central",Advertising,Other,"","  ","","","TXT/50601231.txt	§Summer Studentship Opportunities§§More jobs from this company§§§§§§§§Job Description§§Job Header§§Summer Studentship Opportunities§§Advertiser: §Auckland Museum§§More jobs from this company§§§§Job Information§§Job Listing Date§§21 Sept 2020§§Location§§Auckland§, §Auckland Central§§Work Type§§Contract/Temp§§Classification§§Advertising, Arts &amp; Media§, §Other§§§§§§§§§  §    §    §      §Summer Studentship Opportunities §      §        §Tāmaki Paenga Hira: Tui tui hono tangata, whenua me te moana.§        §Auckland War Memorial Museum: Connecting through sharing stories of people, lands and seas§        § Auckland Museum is a much-loved culture and heritage organisation at the heart of Auckland's identity, committed to developing and sharing engaging content through its galleries, exhibition, events and educational programmes. We are Auckland's home of commemoration as well as the country's oldest research institution and a major tourist destination.§        § Our summer studentship opportunities enable students to learn more about the research and practice of Auckland Museum. Students will work alongside Museum staff to undertake a project that enables them to gain experience in an area of museum practice or research that they are interested in and that complements their studies.§        § Please refer to the descriptions of each summer student project, available www.aucklandmuseum.com/scholarships§        § A stipend of $6,000 is awarded to each successful student and the programme will cover a ten-week period between mid-November and mid-February§        §To be successful, you will have:§        §          §Completed at least two years of a tertiary qualification, in a field related to the project that the student is applying for§          §Have a strong academic record§          §Be able to work independently§          §Be curious, interested, eager to learn§          §Some previous work experience§          §Evidence of ability to manage time§          §Ability to take initiative and 'have a go'§          §Ability to think creatively in terms of problem-solving§          §Strong attention to detail, but also an interest in 'the big picture'§          §Great communication skills§          §Be hard working and diligent§        §        §Closing Date:  Friday 9th October 2020 5.00pm§        § You must be currently enrolled in a New Zealand tertiary institution and have completed at least two years of a tertiary course to be eligible to apply for the summer studentships.§        § Please include your academic transcript, along with your brief CV and a cover letter when you apply. You will be asked to indicate which of the projects you are applying for.§        § Auckland Museum offers a rich and fulfilling work life where we embrace diversity and nurture our bicultural capability as demonstrated in our Teu le Va and He Korahi Maori strategies. We also offer a range of great benefits and an award-winning wellbeing programme.§        §This is a great opportunity for someone looking to be part of a fabulous New Zealand organisation committed to telling our national and Auckland stories, reflecting our unique place in the South Pacific. §        §He Oranga Tangata ka ao   §        §Enriching lives: Inspiring discoveries§      §      §      §    §    §careers.aucklandmuseum.com§    §  §§§Tāmaki Paenga Hira: Tui tui hono tangata, whenua me te moana.§  §Auckland War Memorial Museum: Connecting through sharing stories of people, lands and seas§  § Auckland Museum is a much-loved culture and heritage organisation at the heart of Auckland's identity, committed to developing and sharing engaging content through its galleries, exhibition, events and educational programmes. We are Auckland's home of commemoration as well as the country's oldest research institution and a major tourist destination.§  § Our summer studentship opportunities enable students to learn more about the research and practice of Auckland Museum. Students will work alongside Museum staff to undertake a project that enables them to gain experience in an area of museum practice or research that they are interested in and that complements their studies.§  § Please refer to the descriptions of each summer student project, available www.aucklandmuseum.com/scholarships§  § A stipend of $6,000 is awarded to each successful student and the programme will cover a ten-week period between mid-November and mid-February§  §To be successful, you will have:§ § §Completed at least two years of a tertiary qualification, in a field related to the project that the student is applying for§ §Have a strong academic record§ §Be able to work independently§ §Be curious, interested, eager to learn§ §Some previous work experience§ §Evidence of ability to manage time§ §Ability to take initiative and 'have a go'§ §Ability to think creatively in terms of problem-solving§ §Strong attention to detail, but also an interest in 'the big picture'§ §Great communication skills§ §Be hard working and diligent§ §Closing Date:  Friday 9th October 2020 5.00pm§  § You must be currently enrolled in a New Zealand tertiary institution and have completed at least two years of a tertiary course to be eligible to apply for the summer studentships.§  § Please include your academic transcript, along with your brief CV and a cover letter when you apply. You will be asked to indicate which of the projects you are applying for.§  § Auckland Museum offers a rich and fulfilling work life where we embrace diversity and nurture our bicultural capability as demonstrated in our Teu le Va and He Korahi Maori strategies. We also offer a range of great benefits and an award-winning wellbeing programme.§  §This is a great opportunity for someone looking to be part of a fabulous New Zealand organisation committed to telling our national and Auckland stories, reflecting our unique place in the South Pacific. §  §He Oranga Tangata ka ao   §  §Enriching lives: Inspiring discoveries§§§§"
