jobId,jobUrl,jobTitle,advertiser,listingDate,workType,location,classification,subClassification,email,phone,experience,xenophobe,jobText
50647752,https://www.seek.co.nz/job/50647752,"Environmental & Security Manager Job in Bay of Plenty - SEEK",NetYourJob,"29 Sept 2020","Full Time","Bay of Plenty, Rotorua","Science & Technology","Earth & Geosciences","","   ",""," right to live and work ","TXT/50647752.txt	§Environmental &amp; Security Manager§§More jobs from this company§§§§§§§§§§Job Description§§Job Header§§Environmental &amp; Security Manager§§Advertiser: §NetYourJob§§More jobs from this company§§§§Job Information§§Job Listing Date§§29 Sept 2020§§Location§§Bay of Plenty§, §Rotorua§§Work Type§§Full Time§§Classification§§Science &amp; Technology§, §Environmental, Earth &amp; Geosciences§§§§§§Please Quote Reference Number 77346§§Do you hold a Bachelor of Science degree or higher?§Experience in a Senior Environmental Management role?§Enjoy an amazing lifestyle in Rotorua!§Red Stag Timber is an industry leader when it comes to producing quality structural and outdoor timber products.  The Company operates Australasia's largest sawmill known as the Waipa Mill producing in excess of 600,000 m3.  We are a well-established successful business providing employment to 400 staff and contractors. The Waipa Mill is located 10mins south of the Rotorua CBD in the central Bay of Plenty region and is the perfect location to work, live and play!§This role will become part of an experienced and capable wider Red Stag Timber team, and reports to the General Manager with one direct report being the Environmental &amp; Security Coordinator. To manage the various role requirements you will need to draw on significant senior environmental management experience, preferably in a similar industry.  §The Environmental &amp; Security Manager role is essential as a senior advisor, in order to achieve our Company's environmental responsibilities and future business aspirations, whilst ensuring the protection of our surrounding environment and community.  §This role will be responsible for maintaining and continuously improving the established environmental management practices, and will advise the senior management team on environmental compliance. The work involved also includes maintaining ISO14001 accreditation; HSNO management and managing all required resource consents. In addition, this role will oversee site security, including monitoring and maintenance of essential fire safety systems.§Applicants for this role should have a minimum of 10 years environmental management experience, and a degree qualification in Science or a related discipline.  §This is a fulltime permanent role with normal hours being Monday to Friday from 8am - 5pm.  Remuneration for this position is negotiable, and will reflect the level of expertise and experience required.  §An application form &amp; role outline is available through our website www.redstagtimber.co.nz people-careers tab or contact: Melissa Bennett, People &amp; Safety Manager for further details Ph. §(07) 349-5874§ email §melissa.b@redstagtimber.co.nz§Your completed application form along with CV and copies of relevant qualification must be received by: §Friday 16th October 2020§Red Stag Timber Ltd§§§§The application form will include these questions:§§Which of the following statements best describes your right to work in New Zealand?§Do you hold a Bachelor of Science degree or higher? (Please answer YES or NO)§Do you have at least 10 years experience in a senior Environmental Management role? (Please answer YES or NO)§Do you have knowledge and experience with resource consents processes? (Please answer YES or NO)§§§Right to live and work§§You must have the§ right to live and work §in this location to apply for this job.§§§"
50648098,https://www.seek.co.nz/job/50648098,"Research & Development Technologist Job in Bay of Plenty - SEEK","Taura Natural Ingredients","29 Sept 2020","Full Time","Bay of Plenty, Tauranga","Science & Technology","Food Technology & Safety","","   ","","Which of the following statements best describes your right to work in New Zealand?","TXT/50648098.txt	§Research &amp; Development Technologist§§More jobs from this company§§§§§§§§§§Job Description§§Job Header§§Research &amp; Development Technologist§§Advertiser: §Taura Natural Ingredients§§More jobs from this company§§§§Job Information§§Job Listing Date§§29 Sept 2020§§Location§§Bay of Plenty§, §Tauranga§§Work Type§§Full Time§§Classification§§Science &amp; Technology§, §Food Technology &amp; Safety§§§§§§Taura Natural Ingredients, a subsidiary of IFF, is a Global Leader in functional fruit ingredient manufacture, providing customer specific solutions for some of the top recognised FMCG brands, with world class production facilities in Mount Maunganui and Belgium.§ §We are seeking a Research &amp; Development Technologist to join our team working at our Mount Maunganui site and reporting to the Research &amp; Development Manager – Asia Pacific.  This is a full-time permanent position that has key functional relationships with many facets of the business.§ §Key responsibilities will be to drive and manage Research &amp; Development projects from a technical point of view, from concept to commercialisation for a variety of markets in the Asia Pacific region, while also assisting with other Taura markets when required.§ §The role will also include the following:§ § §Technical lead of customer led new product development projects including the preparation of specifications, costings &amp; compliance information &amp; conducting trials§ §Technical support to key customers including operations, sales managers &amp; external customers§ §Travel from time to time§ §Leading &amp; driving global research &amp; innovation projects§ §Involvement in identification of key insights to aid innovation§ §Identification &amp; implementation of continuous improvement opportunities§ §Raw material assessments§ §The successful candidate will have the following attributes:§ § §Bachelor’s degree – Food Technology or similar§ §3+ years in Product Development/ Research &amp; Development roles within the food industry§ §Creative &amp; able to think outside the box with a passion for food§ §Confidence in interpreting the New Zealand Australia Food Standards Code§ §Project &amp; time management experience§ §Proactive &amp; able to drive progress§ §Excellent written &amp; oral communication skills§ §High level of attention to detail§ §An enthusiastic, flexible team player with a high level of personal integrity§ §Remuneration will be competitive and includes Southern Cross Healthcare.§ §Please submit application letter and CV by §30th October 2020§.  Only those applicants successful in an interview will be contacted.§ §You must have the right to live and work in this location to apply for this job.§ §Please submit your application (including CV) to:§ §Attn: R&amp;D Manager – Asia Pacific§§§§The application form will include these questions:§§Which of the following statements best describes your right to work in New Zealand?§How many years of project management experience do you have?§Do you have a current New Zealand driver&#x27;s licence?§§§"
50648456,https://www.seek.co.nz/job/50648456,"Customer Service Officer - Scientific industry Job in Auckland - SEEK","Bio-Strategy Ltd","29 Sept 2020","Full Time","Auckland, Rodney & North Shore","Science & Technology",Other,"","     ","","Which of the following statements best describes your right to work in New Zealand?","TXT/50648456.txt	§Customer Service Officer - Scientific industry§§More jobs from this company§§§§§§§§§§Job Description§§Job Header§§Customer Service Officer - Scientific industry§§Advertiser: §Bio-Strategy Ltd§§More jobs from this company§§§§Job Information§§Job Listing Date§§29 Sept 2020§§Location§§Auckland§, §Rodney &amp; North Shore§§Work Type§§Full Time§§Classification§§Science &amp; Technology§, §Other§§§§§§Bio-Strategy Limited §is a leading scientific distributor supplying high quality instruments, services and laboratory products to customers throughout New Zealand and Australia. In New Zealand.  The team is comprised of a group of highly qualified and skilled sales professionals, along with exceptional service engineers and application scientists who deliver complete technology solutions to our customers.§  §Our broad customer base includes pharmaceutical and medical research centres, biotech companies, industrial, educational and government organisations. Our mission is to provide our customers with quality solutions through the supply of scientific and technology based products, services and information.§  §We have a vacancy for a Customer Service Officer to handle our New Zealand customer enquiries. In this role your primary focus is to provide exceptional service to our customers.§  §This role is pivotal to the success of the company as it is varied and demanding requiring technical knowledge of our products and general laboratory equipment as well as an understanding of customer service, time management, order entry and prioritising tasks.§  §Team work and focus on results is an essential element of the role. There will be close and constant communication with the Customer Service Manager and the wider New Zealand operations team.§  §The successful candidate will possess:§  §·         Exceptional Communication skills§  §·         Excellent phone manner§  §·         Previous experience in a customer service or sales role§  §·         Customer focused attitude§  §·         Technical knowledge of medical or laboratory equipment§  §·         Qualifications in any Science discipline (non-essential)§  §·         Ability to convert an inquiry into a sale§  §·         Excellent computer skills§  §·         Previous experience with ERP systems (ie NetSuite)§  §·         Willingness to go above and beyond the call of duty§  §·         Capable of working in a fast-paced environment§  §·         Team player§  §·         Ability to use own initiative§  §·         Attention to detail§  §·         Rights to work in New Zealand§  §If you feel you have what it takes to fulfil this role please click on the apply button and forward your cover letter and CV.§  §Due to the high volume of candidates we usually receive o§nly those applicants who are successfully shortlisted will be contacted. §  § §§§§The application form will include these questions:§§Which of the following statements best describes your right to work in New Zealand?§What&#x27;s your expected annual base salary?§How much notice are you required to give your current employer?§Do you have a current New Zealand driver&#x27;s licence?§What&#x27;s your highest level of education?§§§"
50649474,https://www.seek.co.nz/job/50649474,"Teaching Laboratory Technician - Pharmacology Job in Auckland - SEEK","The University of Auckland","29 Sept 2020","Full Time","Auckland, Auckland Central","Science & Technology","Laboratory & Technical Services","","    ","","","TXT/50649474.txt	§Teaching Laboratory Technician - Pharmacology§§More jobs from this company§§§§§§§§§§§Job Description§§Job Header§§Teaching Laboratory Technician - Pharmacology§§Advertiser: §The University of Auckland§§More jobs from this company§§§§Job Information§§Job Listing Date§§29 Sept 2020§§Location§§Auckland§, §Auckland Central§§Work Type§§Full Time§§Classification§§Science &amp; Technology§, §Laboratory &amp; Technical Services§§§§§§Job Description§  §We are seeking an enthusiastic §Teaching Laboratory Technician §within the Faculty of Medical and Health Sciences.§  §The opportunity§  §You will play an essential role in the planning and organisation of the Pharmacology undergraduate teaching laboratories.  With close to 550 students you are responsible for the technical set up and delivery of the highly specialized and extensive laboratory programme.§  §Key responsibilities include§ § §The preparation and setting up of the Pharmacology student laboratories§ §The acquisition of consumables§ §The handling of animals and animal tissue§ §Maintaining Health and Safety standards as per University and legislative requirements§ §About you§ § §You will hold a BSc, MSc or equivalent in Pharmacology or Biomedical Science§ §You will have experience in a tertiary teaching laboratory§ §You will have the experience in cell culture, phase contrast and fluorescent imaging and the use of plate readers and spectrophotometers§ §You are able to plan and develop the required cells for multiple students sessions§ §or more detailed information on the role accountabilities and requirements, please review this Position Description §HERE. §  §Why work with us§  §The University of Auckland offers an environment and position in the Auckland employment market that is both diverse and incredibly unique. We are looking towards the future and this is a rare and very special opportunity.§  §In addition, we offer:§ § §Five weeks’ annual leave per annum. § §Career development programmes.§ §A diverse and inclusive working environment that directly contributes to improving the lives of students§ §We also offer a 6.75% superannuation scheme, a generous parental leave allowance, discounted onsite childcare and a number of other discounts on internal and external services. §  §For more information on the benefits of working here, please see our §Staff Benefits§ page.§  §Apply§  §Applications should be submitted online, before the closing date of §Wednesday, 21 October 2020 §and include an up to date CV and cover letter outlining what strengths you will bring to this role. §  §This is a permanent, full-time position on Technical Services Grade E§  §Additional Information§  §In accordance with our commitment to equitable recruitment, the University welcomes applications from all suitably qualified and experienced candidates. In response to COVID-19 the New Zealand Government has imposed a travel ban and are currently only allowing New Zealand Residents, Citizens and visa holders meeting a strict exception policy  to enter the country, all of whom must currently enter Government approved quarantine for two weeks on arrival. § §  §It is uncertain when these border restrictions will change, and this may impact the degree to which an §off-shore§ candidate can engage in the interview process; or be available to commence in a new position. For more information and updates on the border restrictions visit the §Immigration New Zealand website§ or the §New Zealand Government’s official Covid-19 website§.§  §The University is committed to meeting its obligations under the Treaty of Waitangi and achieving equity outcomes for staff and students in a safe, inclusive and equitable environment. For further information on services for Māori, Pacific, women, LGBTQITakatāpui+, people with disabilities, parenting support, flexible work and other equity issues go to §www.equity.auckland.ac.nz§.§§§§"
50653569,https://www.seek.co.nz/job/50653569,"Technical Innovation Manager Job in Auckland - SEEK","Try the SEEK app to find your dream job faster.","29 Sept 2020","Full Time",Auckland,"Science & Technology","Food Technology & Safety","","  ","","","TXT/50653569.txt	§Technical Innovation Manager§§Private Advertiser§§§§§§§§Job Description§§Job Header§§Technical Innovation Manager§§Private Advertiser§§§§Job Information§§Job Listing Date§§29 Sept 2020§§Location§§Auckland§§Work Type§§Full Time§§Classification§§Science &amp; Technology§, §Food Technology &amp; Safety§§§§§§Technical Innovation Manager § §This large multinational is one of New Zealand's leading manufacturers exporting recognizable product worldwide.§ §This exciting role is critical leading the technical and innovation function providing technical support and expertise to their customers and internally supporting their Sales team. Naturally there is some travel required both domestically and internationally.§ §Your extensive Technical skills expertise; from food, dairy, pharmaceutical, sectors; will be fully utilised in this unique and challenging position.§ §Your responsibilities include the following: § §· Leading  the Technical and Innovation function§ §·  Building strong relationships with key customers and     providing technical support for optimal  solutions§ §· Conduct new product trials and product development to     ensure effectiveness and compliance with a focus on  continuous improvement and innovation§ §· Leading investigations to support customers to solve any issues§ §· Oversee and support patents/ design protection on any  new designs and concepts§ §· Ensuring all regulatory compliance requirements are met and maintained§ § § §In addition the successful candidate will need to demonstrate:§ §· Proven ability to influence and communicate with a wide range of people; with a strong customer focus§ §· Strong analytical and problem-solving skills with a focus on continuous improvement§ §· Ability to manage multiple projects with a methodical approach§ §· Goal focused with exceptional time management skills§ §·  Knowledge of manufacturing processes/food industry§ §·  Relevant tertiary qualifications Food Science,  Product innovation or applied science .§ §This is a fantastic opportunity that will provide challenge, variety and opportunities to really make your mark.§ §If you are interested  in finding out more please apply using the link below§§§§"
50653778,https://www.seek.co.nz/job/50653778,"Business Development Specialist Job in Waikato - SEEK","Analytica Laboratories Ltd","29 Sept 2020","Full Time","Waikato, Hamilton","Science & Technology",Other,"","  ","","","TXT/50653778.txt	§Business Development Specialist§§More jobs from this company§§§§§§§§Job Description§§Job Header§§Business Development Specialist§§Advertiser: §Analytica Laboratories Ltd§§More jobs from this company§§§§Job Information§§Job Listing Date§§29 Sept 2020§§Location§§Waikato§, §Hamilton§§Work Type§§Full Time§§Classification§§Science &amp; Technology§, §Other§§§§§§Analytica is a and fast growing and innovative company providing testing services to a wide range of market sectors including water, environmental, occupational hygiene, honey, dairy, and other natural products. We have an exciting opportunity for a Market Development Specialist to join our business development and sales function team.§You will work right at the coal-face with our clients, so relevant technical knowledge (or an ability to learn fast) is vital. A background in science is an advantage, especially related to water, the environment, and/or occupational hygiene. We are very interested in candidates with experience in electronic communications and marketing, and the application to website and other social media. §We pride ourselves on being friendly and customer focused, going that ‘extra mile’ to make sure that our growing customer base get what they need. This role is part of a small but growing team, reporting to the Market Development Manager. While Hamilton based, you will have the opportunity to travel to meet and support the clients we have throughout New Zealand. §This is a fantastic opportunity to become part of one of New Zealand's real business success stories, providing customer solutions by combining your enjoyment of commercial science with your passion for people.§§§§"
