jobId,jobUrl,jobTitle,advertiser,listingDate,workType,location,classification,subClassification,email,phone,experience,xenophobe,jobText
50600212,https://www.seek.co.nz/job/50600212,"Manager - Histology Job in Otago - SEEK","University of Otago","21 Sept 2020","Full Time","Otago, Dunedin","Science & Technology","Laboratory & Technical Services","","  ",""," right to live and work ","TXT/50600212.txt	§Manager - Histology§§More jobs from this company§§§§§§§§Job Description§§Job Header§§Manager - Histology§§Advertiser: §University of Otago§§More jobs from this company§§§§Job Information§§Job Listing Date§§21 Sept 2020§§Location§§Otago§, §Dunedin§§Work Type§§Full Time§§Classification§§Science &amp; Technology§, §Laboratory &amp; Technical Services§§§§§§§§§  §    §    §      §Manager - Histology §      §        §HISTOLOGY MANAGER - OTAGO MICRO and NANOSCALE IMAGING (OMNI) §DIVISION of HEALTH SCIENCES§        §The University of Otago is a research-intensive university with a long history of excellence. Ranked within the top 1% of universities in the world, the University of Otago recognises that our staff are the key to our success.§        §The University supports world-leading researchers with highly specialised research facilities and equipment. Otago Micro and Nanoscale Imaging (OMNI) encompasses the Histology, Electron Microscopy, Confocal Microscopy and Flow Cytometry units in the Health Sciences Division.§        §The role§        §We are seeking an experienced Histologist to provide overall management of the OMNI Histology laboratory. This is a great opportunity for a motivated leader, reporting to the Operations Manager, you will manage and promote a team approach to the delivery of high quality histology services that meet the clinical and research requirements of University staff and students.§        §In addition to this you will also:§        §          §Ensure the laboratory provides a prompt, reliable, quality focused service to all customers.§          §Ensure the highest professional and ethical standards are practiced and accurate records are kept.§          §Contribute to the development of the laboratory equipment and techniques to enhance the service provided.§          §Provide advice and practical assistance to staff and students, offering training in histological methods as required.§          §Develop and enhance the technical skills of staff.§        §        §Your skills and experience§        §To be successful in this role you will have:§        §          §Graduate qualification in Histology, i.e. Bachelor of Medical Laboratory Science (BMLSc) or equivalent experience.§          §Experience in preparing specimens for microtomy (wax, resin, and frozen sections) and with staining (H&amp;E, special stains and immunohistochemistry) in a medical laboratory environment or similar.§          §Competence in light and digital microscopy.§          §Demonstrated understanding of appropriate procedures for handling human and animal tissues.§          §Experience in the use of hazardous chemicals, safety protocols and laboratory compliance procedures.§          §Highly developed interpersonal skills and a collaborative management style.§          §Excellent attention to detail, adaptability and reliable.§        §        §Further details§        §This is a full-time, permanent position based in Dunedin.§        §You must have the right to live and work in New Zealand to apply for this job.§        §The University of Otago is well-known for its collegiality and, combined with living in the vibrant city of Dunedin, provides opportunities for an excellent work-life balance. The Dunedin campus is ranked as one of the top 15 most beautiful in the world. The city has affordable living, excellent schools, and a great array of activities, ranging from art and literature to outdoor activities.§        §Application§        §Applications quoting reference number 2001602 will close on Friday, 9 October 2020.§        §Candidates are requested to submit the following:§        §          §A cover letter.§          §A CV.§          §Names and email addresses of at least three referees.§        §      §      §      §    §    §  §§§HISTOLOGY MANAGER - OTAGO MICRO and NANOSCALE IMAGING (OMNI) §DIVISION of HEALTH SCIENCES§The University of Otago is a research-intensive university with a long history of excellence. Ranked within the top 1% of universities in the world, the University of Otago recognises that our staff are the key to our success.§The University supports world-leading researchers with highly specialised research facilities and equipment. Otago Micro and Nanoscale Imaging (OMNI) encompasses the Histology, Electron Microscopy, Confocal Microscopy and Flow Cytometry units in the Health Sciences Division.§The role§We are seeking an experienced Histologist to provide overall management of the OMNI Histology laboratory. This is a great opportunity for a motivated leader, reporting to the Operations Manager, you will manage and promote a team approach to the delivery of high quality histology services that meet the clinical and research requirements of University staff and students.§In addition to this you will also:§Ensure the laboratory provides a prompt, reliable, quality focused service to all customers.§Ensure the highest professional and ethical standards are practiced and accurate records are kept.§Contribute to the development of the laboratory equipment and techniques to enhance the service provided.§Provide advice and practical assistance to staff and students, offering training in histological methods as required.§Develop and enhance the technical skills of staff.§§Your skills and experience§To be successful in this role you will have:§Graduate qualification in Histology, i.e. Bachelor of Medical Laboratory Science (BMLSc) or equivalent experience.§Experience in preparing specimens for microtomy (wax, resin, and frozen sections) and with staining (H&amp;E, special stains and immunohistochemistry) in a medical laboratory environment or similar.§Competence in light and digital microscopy.§Demonstrated understanding of appropriate procedures for handling human and animal tissues.§Experience in the use of hazardous chemicals, safety protocols and laboratory compliance procedures.§Highly developed interpersonal skills and a collaborative management style.§Excellent attention to detail, adaptability and reliable.§§Further details§This is a full-time, permanent position based in Dunedin.§You must have the right to live and work in New Zealand to apply for this job.§The University of Otago is well-known for its collegiality and, combined with living in the vibrant city of Dunedin, provides opportunities for an excellent work-life balance. The Dunedin campus is ranked as one of the top 15 most beautiful in the world. The city has affordable living, excellent schools, and a great array of activities, ranging from art and literature to outdoor activities.§Application§§Applications quoting reference number 2001602 will close on Friday, 9 October 2020.§Candidates are requested to submit the following:§A cover letter.§A CV.§Names and email addresses of at least three referees.§§§§Right to live and work§§You must have the§ right to live and work §in this location to apply for this job.§§§"
50601573,https://www.seek.co.nz/job/50601573,"Manager - Central Geotechnical Job in Bay of Plenty - SEEK",Beca,"21 Sept 2020","Full Time","Bay of Plenty, Tauranga","Science & Technology","Earth & Geosciences","","+64 9 336 5954","","","TXT/50601573.txt	§Manager - Central Geotechnical§§More jobs from this company§§§§§§§§Job Description§§Job Header§§Manager - Central Geotechnical§§Advertiser: §Beca§§More jobs from this company§§§§Job Information§§Job Listing Date§§21 Sept 2020§§Location§§Bay of Plenty§, §Tauranga§§Work Type§§Full Time§§Classification§§Science &amp; Technology§, §Environmental, Earth &amp; Geosciences§§§§§§§§§  §    §    §      §Manager - Central Geotechnical §      §        §§        §Manager - Central Geotechnical§        §          §Helping to make our people the very best they can be§          §Foster a culture that encourages collaboration and work-sharing across geographies§          §Be based in Hamiton, Wellington, Tauranga or New Plymouth §        §        §Are you someone with the desire and potential to move into a leadership role? Our national Geotechnical Section has almost doubled in size over the last few years and that growth has meant that we are now able to create new leadership opportunities to ensure that we continue to achieve great outcomes for our clients, while maintaining our culture of care.§        §The opportunity§Our Central Geotechnical business is a high performing, strongly collegial team of geotechnical engineers, engineering geologists and hydrogeologists. Your role will be to continue to foster a culture that encourages collaboration and work-sharing across geographies, that focuses on growing client and market diversity and celebrates technical excellence.§        §You will be helping to make our people the very best they can be! To support the growth of our Geotechnical business we are looking for a passionate and engaging leader to inspire and empower our people. As our Central Region Geotechnical Manager you will be leading a team of approximately 35 people across Hamilton, Tauranga, Wellington and New Plymouth.§        §In this role you are primarily responsible for:§        §          §Fostering a culture of excellence in technical delivery, client service, innovation and commercial management across the business§          §Leading the development of a constructive team culture focused on collaboration and teamwork§          §Coaching and guiding a group of 5 Team Leaders as your direct reports§          §Developing, delivering and monitoring section specific business plans§          §Actively working with others in the Beca leadership group to achieve strategic and aspirational goals§          §Leading or contributing to pursuits and bids§          §Recruiting, retaining and developing talent§        §        §About you§To be successful in this role, you'll have a passion for leadership and guiding and mentoring others. You’ll have an affinity for driving success as an experienced leader who excels in building relationships and turning opportunities into outcomes. Known for your team focused people management skills that inspire a positive attitude and with sound commercial acumen and financial literacy to lead a sustainable and commercially successful business, you will love to learn and share your knowledge across the team, both in the technical and leadership space. §        §What we offer§A career with Beca will provide you with:§        §          §Professional development opportunities.§          §A supportive and caring work environment where you can bring your whole self to work.§          §Flexible working arrangements to balance your personal / family commitments.§          §Opportunities to learn from our industry experts and technical gurus across the Asia-Pacific.§          §Highly supportive environment of sharing and collaboration.§          §Excellent benefits provided to all staff - including discounted health insurance, discounts on gym memberships, and lots of social club events.§        §        §Beca prides itself on supporting a diverse and inclusive culture - open to inputs from creative people of all genders, ethnicity, identity, thought and experiences.§        §Ready to make the move?§If you want to make everyday better, apply online today! If you have any questions, call Autumn English - Talent Acquisition Business Partner on §+64 9 336 5954§.§        §About Beca§Beca is one of Asia Pacific's largest independent advisory, design and engineering consultancies. 2020 is a landmark year for Beca, representing both the dawn of a new decade and the beginning of our 2nd century. Throughout this year, we will celebrate our innovators, our thinkers, our explorers and our entrepreneurs; past, present and future.§        §We are a team of 3300-plus who brings a wide range of perspectives and expertise to every client and challenge, creating resourceful, smart solutions from our collective experience and insights.§        §While our experience has been 100 years in the making, it’s the fresh talent we’re nurturing, the innovative thinking we’re developing and the connections that we’re forging that gets us most excited for the future. www.beca.com.§        § §      §      §      §    §    §  §§§§Manager - Central Geotechnical§Helping to make our people the very best they can be§Foster a culture that encourages collaboration and work-sharing across geographies§Be based in Hamiton, Wellington, Tauranga or New Plymouth §Are you someone with the desire and potential to move into a leadership role? Our national Geotechnical Section has almost doubled in size over the last few years and that growth has meant that we are now able to create new leadership opportunities to ensure that we continue to achieve great outcomes for our clients, while maintaining our culture of care.§The opportunity§Our Central Geotechnical business is a high performing, strongly collegial team of geotechnical engineers, engineering geologists and hydrogeologists. Your role will be to continue to foster a culture that encourages collaboration and work-sharing across geographies, that focuses on growing client and market diversity and celebrates technical excellence.§You will be helping to make our people the very best they can be! To support the growth of our Geotechnical business we are looking for a passionate and engaging leader to inspire and empower our people. As our Central Region Geotechnical Manager you will be leading a team of approximately 35 people across Hamilton, Tauranga, Wellington and New Plymouth.§In this role you are primarily responsible for:§Fostering a culture of excellence in technical delivery, client service, innovation and commercial management across the business§Leading the development of a constructive team culture focused on collaboration and teamwork§Coaching and guiding a group of 5 Team Leaders as your direct reports§Developing, delivering and monitoring section specific business plans§Actively working with others in the Beca leadership group to achieve strategic and aspirational goals§Leading or contributing to pursuits and bids§Recruiting, retaining and developing talent§About you§To be successful in this role, you'll have a passion for leadership and guiding and mentoring others. You’ll have an affinity for driving success as an experienced leader who excels in building relationships and turning opportunities into outcomes. Known for your team focused people management skills that inspire a positive attitude and with sound commercial acumen and financial literacy to lead a sustainable and commercially successful business, you will love to learn and share your knowledge across the team, both in the technical and leadership space. §What we offer§A career with Beca will provide you with:§Professional development opportunities.§A supportive and caring work environment where you can bring your whole self to work.§Flexible working arrangements to balance your personal / family commitments.§Opportunities to learn from our industry experts and technical gurus across the Asia-Pacific.§Highly supportive environment of sharing and collaboration.§Excellent benefits provided to all staff - including discounted health insurance, discounts on gym memberships, and lots of social club events.§Beca prides itself on supporting a diverse and inclusive culture - open to inputs from creative people of all genders, ethnicity, identity, thought and experiences.§Ready to make the move?§If you want to make everyday better, apply online today! If you have any questions, call Autumn English - Talent Acquisition Business Partner on §+64 9 336 5954§.§About Beca§Beca is one of Asia Pacific's largest independent advisory, design and engineering consultancies. 2020 is a landmark year for Beca, representing both the dawn of a new decade and the beginning of our 2nd century. Throughout this year, we will celebrate our innovators, our thinkers, our explorers and our entrepreneurs; past, present and future.§We are a team of 3300-plus who brings a wide range of perspectives and expertise to every client and challenge, creating resourceful, smart solutions from our collective experience and insights.§While our experience has been 100 years in the making, it’s the fresh talent we’re nurturing, the innovative thinking we’re developing and the connections that we’re forging that gets us most excited for the future. www.beca.com.§ §§§§"
50605509,https://www.seek.co.nz/job/50605509,"Chemical Formulation Technician Job in Canterbury - SEEK","University of Canterbury","21 Sept 2020","Full Time","Canterbury, Christchurch","Science & Technology","Laboratory & Technical Services","","  ",""," right to live and work ","TXT/50605509.txt	§Chemical Formulation Technician§§More jobs from this company§§§§§§§§§§§Job Description§§Job Header§§Chemical Formulation Technician§§Advertiser: §University of Canterbury§§More jobs from this company§§§§Job Information§§Job Listing Date§§21 Sept 2020§§Location§§Canterbury§, §Christchurch§§Work Type§§Full Time§§Classification§§Science &amp; Technology§, §Laboratory &amp; Technical Services§§§§§§School of Product Design - Kura Hanga Otinga§Full-time at 37.5 hours per week (1.0 FTE)§Continuing (i.e. permanent) position§What You Will Do§The School of Product Design seeks a Chemical Formulation Technician to provide technical support, advice and teaching to students and staff, in particular in the area of chemical, natural and healthcare product preparation and formulation for teaching and research.§Who You Are§To be successful in this role you will hold a NZ Diploma in Applied Science (NZQA Level 6), or a Bachelor's degree in Chemistry, Biochemistry or Pharmacy. You will have sound experience in a chemistry/pharmacy/analytical laboratory setting within innovative, varied and technically challenging environments. You must also have experience in the accurate preparation and analysis of standard acids, bases and buffers, accurate calibration and maintenance of standard chemical laboratory instruments. Experience in the preparation of personal care formulations such as cosmetics, hair or skincare creams, or the creation of industrial chemical products would be an advantage.§Who You Will Work With§The School of Product Design is committed to excellence in teaching, research and creative practice at the forefront of product design, and producing versatile, innovative graduates who can contribute to New Zealand's future economic growth and social wellbeing. Our current technical team includes five workshop technicians and one formulation laboratory technician (in addition to this new role), while our fourteen academic staff cover industrial product design, applied game design and chemical formulation design. We have a large number of students, ranging from first-year to master's and doctoral studies.§We aim to continually improve our teaching and research programmes by attracting and retaining highly-skilled academic and support staff, expanding our facilities, and growing our national and international links with other leading design schools and employers.§For more information about the School and our team, please visit our §website. §Please take a §virtual tour§ of our Engineering facilities.§Why UC§Tangata Tū, Tangata Ora - Engaged, Empowered, Making a Difference.§The University of Canterbury is committed to accessible higher education, service to community and the encouragement of talent without barriers of distance, wealth, class, gender or ethnicity. The University explicitly aims to produce graduates and support staff who are engaged with their communities, empowered to act for good and determined to make a difference in the world.§For information about the range of fantastic benefits that UC offers including flexible work practices, study opportunities and generous superannuation and leave provisions, please visit us: §http://www.canterbury.ac.nz/joinus§The University of Canterbury is an Equal Employment Opportunities (§EEO§) employer and we encourage diversity in our staffing profile. The University of Canterbury actively seeks to meet its obligation under the Treaty of Waitangi - Te Tiriti o Waitangi.§The closing date for this position is: Sunday, 11th October 2020 (midnight, NZ time)§How You Apply§Applications for this position must be submitted on our §careers website§ and should include a cover letter and resume§. §Please note, we do not accept applications by email, however we are happy to answer your queries in relation to the application process, please forward these to §WorkatUC@canterbury.ac.nz§Due to current border restrictions, you must have New Zealand Citizenship/Residency to be considered for this role. If you hold a valid work visa and are physically present in New Zealand then you may also be considered.§Click here to view the role description§§§§Right to live and work§§You must have the§ right to live and work §in this location to apply for this job.§§§"
50608278,https://www.seek.co.nz/job/50608278,"Formulations Manager  Job in Southland - SEEK","HR South","22 Sept 2020","Full Time","Southland, Invercargill","Science & Technology","Food Technology & Safety","","  ","","","TXT/50608278.txt	§Formulations Manager §§More jobs from this company§§§§§§§§Job Description§§Job Header§§Formulations Manager §§Advertiser: §HR South§§More jobs from this company§§§§Job Information§§Job Listing Date§§22 Sept 2020§§Location§§Southland§, §Invercargill§§Work Type§§Full Time§§Classification§§Science &amp; Technology§, §Food Technology &amp; Safety§§§§§§Tucked away in the deep south is world class nutritional formula manufacturer Blue River Dairy who developed the world’s first sheep milk formula using exclusively sheep milk protein, and today remains the only plant in the world manufacturing nutritional formulas using milks from three different species sheep, goat and cow. §Blue River Dairy continues to grow at a rapid pace, recently ranked Fastest Growing Exporter in the Deloitte Fast 50 index and the 5th Fastest Growing Business in NZ. §As a result of our growth and some internal movement we are looking to fill a new key position in our Technical team. This is a highly technical role with some leadership responsibility. The Formulations Manager will be responsible for formulation and product specification development and product and process optimisation.  The successful candidate will ensure all products are produced safely, legally and are in accordance with product specifications and compliance standards for both New Zealand and exported countries. §What you need: §A number of years experience in dairy nutrition formula development with relevant qualifications in Food Science or similar§Previous development and implementation of formulation products §Understanding of spray drying, dry powder blending, conveying and filling processing §Ideally some knowledge of CNCA/GACC (China) and CFDA/SAMR specific infant formula guidelines and standards§Excellent written and oral English communication §Project management and new product development experience preferable§§What we can offer you: §Flexible working arrangements with the potential to work remotely and paid travel to visit the site – base yourself anywhere, or join us in beautiful Invercargill. §Senior technical role with the opportunity to influence development projects §A supportive team environment where we value our staff and their contribution §Competitive remuneration reflective of experience and expertise§This is a unique, specialist opportunity that doesn’t come up often, we encourage you to apply if you are interested in the role and think you meet the above criteria. For a confidential discussion or for more information including a job description please contact §erin@hrsouth.co.nz§.§§§§"
