jobId,jobUrl,jobTitle,advertiser,listingDate,workType,location,classification,subClassification,email,phone,experience,xenophobe,jobText
50423988,https://www.seek.co.nz/job/50423988,"Scientist - Laboratory Analyst - Scion Job in Bay of Plenty - SEEK","New Zealand Forest Research Ltd tradingas Scion","19 Aug 2020","Full Time","Bay of Plenty, Rotorua","Science & Technology","Chemistry & Physics","","     ","Someone who possesses a PhD, or MSc qualification with at least 3 years","","TXT/50423988.txt	§Scientist - Laboratory Analyst - Scion§§More jobs from this company§§§§§§§§Job Description§§Job Header§§Scientist - Laboratory Analyst - Scion§§Advertiser: §New Zealand Forest Research Ltd tradingas Scion§§More jobs from this company§§§§Job Information§§Job Listing Date§§19 Aug 2020§§Location§§Bay of Plenty§, §Rotorua§§Work Type§§Full Time§§Classification§§Science &amp; Technology§, §Chemistry &amp; Physics§§§§§§§§§  §    §    §      §        §Scientist - Laboratory Analyst - Scion §        §          §            §A role that offers the co-ordination and carrying out of analytical laboratory work§            §Opportunity to work in a stimulating and diverse science organisation§            §Full-time permanent position§          §          §Scion specialises in research, science and technology development for the forest industry, wood products and wood-derived material and other biomaterials sectors. Our purpose is to drive innovation and growth from these sectors to create economic value and contribute to beneficial environmental and social outcomes form New Zealand.§          §About the role§          §Our Scientist role will not only provide the co-ordination and carrying out of analytical laboratory work but will also support aspects of research projects involving advanced analytical chemistry techniques. A major part of the role is developing and maintaining high-quality analytical capability to serve multiple teams, while also having the flexibility to undertake other roles in projects that require chemistry skills.§          §What are we looking for?§          §Someone who possesses a PhD, or MSc qualification with at least 3 years research, or alternatively commercial experience in chemistry.§          §We are also looking for someone who has extensive technical knowledge of and hands-on experience with the maintenance or troubleshooting of equipment and proven expertise in analytical chemistry, especially using and interpreting complex MS (mass spectrometry) data and data from its coupled techniques.§          §Our preferred candidate will have the ability to undertake experimental investigations without close supervision, and to consistently produce high quality results, has familiarity with instrumental techniques such as mass spectrometry, FT-IR, UV-Vis, HPLC, and IC.§          §If you are a self-driven individual who is customer focussed; enjoys being part of a team; and is proud of your ability to pick up on technical things quickly then we would love to hear from you.§          §We are home to creative science minds and have a vibrant culture ensuring employees can pursue innovation and excellence in their science delivery. With its head office based on the edge of Rotorua's world famous Whakarewarewa Forest, Scion also offers an enviable working environment with excellent work/life balance initiatives. Rotorua is one of New Zealand's leading tourist destinations owing to its outstanding natural environment and proximity to coastal beaches and inland lakes, native forests, geothermal areas and volcanic ski-fields.§        §        §        §      §    §    §  §§§A role that offers the co-ordination and carrying out of analytical laboratory work§Opportunity to work in a stimulating and diverse science organisation§Full-time permanent position§Scion specialises in research, science and technology development for the forest industry, wood products and wood-derived material and other biomaterials sectors. Our purpose is to drive innovation and growth from these sectors to create economic value and contribute to beneficial environmental and social outcomes form New Zealand.§About the role§Our Scientist role will not only provide the co-ordination and carrying out of analytical laboratory work but will also support aspects of research projects involving advanced analytical chemistry techniques. A major part of the role is developing and maintaining high-quality analytical capability to serve multiple teams, while also having the flexibility to undertake other roles in projects that require chemistry skills.§What are we looking for?§Someone who possesses a PhD, or MSc qualification with at least 3 years research, or alternatively commercial experience in chemistry.§We are also looking for someone who has extensive technical knowledge of and hands-on experience with the maintenance or troubleshooting of equipment and proven expertise in analytical chemistry, especially using and interpreting complex MS (mass spectrometry) data and data from its coupled techniques.§Our preferred candidate will have the ability to undertake experimental investigations without close supervision, and to consistently produce high quality results, has familiarity with instrumental techniques such as mass spectrometry, FT-IR, UV-Vis, HPLC, and IC.§If you are a self-driven individual who is customer focussed; enjoys being part of a team; and is proud of your ability to pick up on technical things quickly then we would love to hear from you.§We are home to creative science minds and have a vibrant culture ensuring employees can pursue innovation and excellence in their science delivery. With its head office based on the edge of Rotorua's world famous Whakarewarewa Forest, Scion also offers an enviable working environment with excellent work/life balance initiatives. Rotorua is one of New Zealand's leading tourist destinations owing to its outstanding natural environment and proximity to coastal beaches and inland lakes, native forests, geothermal areas and volcanic ski-fields.§§§§"
50476193,https://www.seek.co.nz/job/50476193,"Casual Sample Technician Job in Waikato - SEEK",MilkTestNZ,"29 Aug 2020","Part Time","Waikato, Hamilton","Science & Technology","Laboratory & Technical Services","","  ","","","TXT/50476193.txt	§Casual Sample Technician§§More jobs from this company§§§§§§§§Job Description§§Job Header§§Casual Sample Technician§§Advertiser: §MilkTestNZ§§More jobs from this company§§§§Job Information§§Job Listing Date§§29 Aug 2020§§Location§§Waikato§, §Hamilton§§Work Type§§Part Time§§Classification§§Science &amp; Technology§, §Laboratory &amp; Technical Services§§§§§§§About Us§§MilkTestNZ is a world class milk testing laboratory using highly automated processes and advanced technology.  We provide farmer payment services to most of the New Zealand dairy industry.  A range of microbiology, composition, analytical and specialty tests are carried out in the laboratory on a variety of milk types including cow, goat, sheep, buffalo and deer milk.§ §Previous experience, though advantageous, is not required.  Full training on the job will be provided.  MilkTestNZ are seeking an enthusiastic individual who has high attention to detail, excellent communication skills and the ability to multitask.  The successful applicant must be a team player and also have the ability to work independently.§This is a part-time position and will require weekend work.§Applicants must be eligible to work in New Zealand to be considered for this role.§Applications will close once the ideal candidate for this position has been found.§§Strong attention to detail.§ §Ability to multi-task and work effectively in a fast-paced environment.§ §Strong interpersonal skills and good judgement.§ §Ability to communicate effectively with all customers and stakeholders.§§§§"
50535140,https://www.seek.co.nz/job/50535140,"Production Technician - Plant Scientist Job in Auckland - SEEK","Superb Herb Company","9 Sept 2020","Full Time","Auckland, Waitakere & West Auckland","Science & Technology","Laboratory & Technical Services",""," 021 460680","","Which of the following statements best describes your right to work in New Zealand?","TXT/50535140.txt	§Production Technician - Plant Scientist§§More jobs from this company§§§§§§§§§§Job Description§§Job Header§§Production Technician - Plant Scientist§§Advertiser: §Superb Herb Company§§More jobs from this company§§§§Job Information§§Job Listing Date§§9 Sept 2020§§Location§§Auckland§, §Waitakere &amp; West Auckland§§Work Type§§Full Time§§Classification§§Science &amp; Technology§, §Laboratory &amp; Technical Services§§§§§§We are looking for a Production Technician/Plant Scientist to join our team and assist the GM Technical Development and Production Operations Manager to achieve optimal production management through monitoring and delivery of technical crop research, plant quality, growing environment, disease and pest control, and monitoring and managing seasonal process changes.§  §This is an exciting role in an established and growing company located 45 minutes drive North West from the Auckland CBD.§  §Key Responsibilities:§  §Crop Production§ § §Monitor irrigation systems § §Communicate to managers if issues or opportunities are identified§ § § §Monitor plant nutrition systems and levels § §Microbiological, pH and EC levels. Advise managers of adjustments and actions required§ § § §Monitor environment data. Advises issues or improvements if not performing optimally§ §Monitor production processes: rotation, layout spacing, house selection, facilitate SOP changes when improvements are identified§ §Plant and variety testing / research§ §Monitor germination testing and liaise with managers regarding required actions§ §New product / variety testing reporting results and recommendations to production and sales and marketing§ §Finished Product§ § §Quality assurance § §Monitor shelf life and customer complaint data and advise managers of issues or opportunities for improvements§ §Monitor crop production data and provide input into Production planning and forecasting tools§ § § §Pest and Disease Control§ § §Monitor pest status and management systems§ §Consider risks when setting up new trials to avoid introduction of new pests and make sure controls are in place§ §R&amp;D§ § §Run / supervise all trial work done in the business or externally§ §Set up trial protocols prior to starting any trial work with clear objective§ §Capture and communicate trial results.§ §Keep up to date with latest global trends and technology§ §Research existing literature prior to setting up research work§ §Manage test equipment and test areas professionally ensuring safety at all times (food safety and occupational health and safety)§ §Communication / Planning§ § §Agree R&amp;D plans annually with the GM Technical Development§ §Agree compliance targets and audit programmes annually§ §Communication of progress and results on a monthly basis§ §Use of meetings for forward planning of activities and making sure all stake holders are consulted and aware of activity§ §Compliance§ § §Monitoring crop data collection, incident &amp; non-conformance reporting with follow up on corrective actions when required.§ §Ensure that testing and measuring equipment is well maintained and calibrated.§ §Assist production operations manager with root cause analysis of major issues and advise on corrective actions.§ §Qualifications required:§ § §A tertiary degree in horticultural science or relevant applied science is required.§ §Experience and Knowledge Required:§ § §Compliance and R&amp;D experience would be an advantage§ §Experience working cross-functionally with other teams including production, operations and sales to achieve results§ §Excel and database skills with a high level of IT literacy§ §Competencies:§ § §Ability to influence at senior levels and develop effective working relationships both internally and externally§ §Ability to work under pressure, manage conflicting demands and meet tight deadlines§ §Excellent problem solving abilities§ §Data analysis and scientific reporting skills§ §Initiative with a focus on achievement§ §Ability to be hands-on, flexible and willing to assist across the team to ensure its success§ §A continuous improvement focus with ability to improve processes and practices§ §Ability to coach and develop staff to deliver results§ §Special Job Requirements:§ § §The job will require the incumbent to based at our Parakai site§ §Ability to work outside normal hours if required§ §To Apply:§  §Graduates are welcome to apply§  §If you would like to discuss this position confidentially, please feel free to call our HR Manager, Alexandra on 021 460680§§§§The application form will include these questions:§§Which of the following statements best describes your right to work in New Zealand?§Which of the following Microsoft Office products are you experienced with?§Do you have a current New Zealand driver&#x27;s licence?§Do you own or have regular access to a car?§§§"
50535659,https://www.seek.co.nz/job/50535659,"Veterinary Laboratory Technicians - Casual Job in Waikato - SEEK","IDEXX Laboratories Pty Ltd","9 Sept 2020",Casual/Vacation,"Waikato, Hamilton","Science & Technology","Laboratory & Technical Services",Kathryn-Kelly@idexx.com,"    ","You will have a tertiary qualification in a relevant technical discipline and (or) a minimum of two years","","TXT/50535659.txt	§Veterinary Laboratory Technicians - Casual§§More jobs from this company§§§§§§§§Job Description§§Job Header§§Veterinary Laboratory Technicians - Casual§§Advertiser: §IDEXX Laboratories Pty Ltd§§More jobs from this company§§§§Job Information§§Job Listing Date§§9 Sept 2020§§Location§§Waikato§, §Hamilton§§Work Type§§Casual/Vacation§§Classification§§Science &amp; Technology§, §Laboratory &amp; Technical Services§§§§§§§§§  §    §    §      §Veterinary Laboratory Technicians - Casual §    §    § §    §      §        §          §IDEXX has been changing the veterinary, livestock, water testing, and dairy markets for the better since 1983. Headquartered in the US and a leader in innovative pet healthcare, we service practicing veterinarians around the world with a broad range of diagnostic and information technology-based products and services. Our products enhance the ability of veterinarians to provide advanced medical care, improve staff efficiency, and build more economically successful practices. We also provide worldwide diagnostic tests and information for livestock and poultry, as well as testing for the quality and safety of water and milk. Through innovation, passion, and integrity, we’ve set a new standard for detection and analysis that continues to enhance §the well-being of pets, livestock, and people around the world. §          § §          §We are currently looking for 4 x casual Veterinary Laboratory Technician’s to work within our Hamilton Laboratory for a 6-month project. The project will involve receiving samples, inputting the samples into our laboratory systems, processing the samples and completing ELISA Testing.§          §Based in our new purpose-built Hamilton laboratory, you would be joining a global market leader in a role focused on the provision of high-quality and timely diagnostic testing services; assaying and processing a wide variety of samples for routine and complex pathology investigation.§          § §          §Who we are looking for:§          § §          §            §You will have a tertiary qualification in a relevant technical discipline and (or) a minimum of two years’ experience in a laboratory environment, with some knowledge of Elisa testing.§            §You will have a strong understanding of all the essentials; a broad knowledge of multi-disciplinary routine diagnostic pathology testing procedures, and a demonstrated ability to perform routine and potentially complex diagnostic tests while ensuring adherence to standard procedures, policies and practices.§            §Experience with the maintenance of plate washers and incubators is desired.§            §Skilled in centrifuging and either manual or electric pipetting (multi-channel is a bonus)§            §You will be computer savvy and have exposure to a Laboratory Information Management System (LIMS).§            §You will have the ability to learn new systems and processes quickly.§            §Intermediate Microsoft Excel skills are highly desired.§            §You will be confident operating under pressure and time constraints without compromising on quality control procedures and practices.§          §          § §          §What we offer:§          § §          §            §An opportunity for you to make your mark alongside the New Zealand business, where we are focused and passionate about the wellbeing and health of pets, people and livestock.§            §A strong supportive infrastructure and assistance where needed, from a highly respected and valued, laboratory team.§            §A close-knit team environment, where there is a tendency to celebrate Fridays with morning tea, and a sense of humour is appreciated.§          §          § §          §If you are passionate about making a difference and being rewarded for your efforts, please§ APPLY §or contact Kathryn Kelly, Talent Acquisition Specialist - §Kathryn-Kelly@idexx.com§.§          §If you would like to learn more about IDEXX and that we do please take a look at our website at https://www.idexx.co.nz/en-nz/§          §§        §      §      §      §      §    §  §§§IDEXX has been changing the veterinary, livestock, water testing, and dairy markets for the better since 1983. Headquartered in the US and a leader in innovative pet healthcare, we service practicing veterinarians around the world with a broad range of diagnostic and information technology-based products and services. Our products enhance the ability of veterinarians to provide advanced medical care, improve staff efficiency, and build more economically successful practices. We also provide worldwide diagnostic tests and information for livestock and poultry, as well as testing for the quality and safety of water and milk. Through innovation, passion, and integrity, we’ve set a new standard for detection and analysis that continues to enhance §the well-being of pets, livestock, and people around the world. § § § §We are currently looking for 4 x casual Veterinary Laboratory Technician’s to work within our Hamilton Laboratory for a 6-month project. The project will involve receiving samples, inputting the samples into our laboratory systems, processing the samples and completing ELISA Testing.§ §Based in our new purpose-built Hamilton laboratory, you would be joining a global market leader in a role focused on the provision of high-quality and timely diagnostic testing services; assaying and processing a wide variety of samples for routine and complex pathology investigation.§ § § §Who we are looking for:§ § § § §You will have a tertiary qualification in a relevant technical discipline and (or) a minimum of two years’ experience in a laboratory environment, with some knowledge of Elisa testing.§ §You will have a strong understanding of all the essentials; a broad knowledge of multi-disciplinary routine diagnostic pathology testing procedures, and a demonstrated ability to perform routine and potentially complex diagnostic tests while ensuring adherence to standard procedures, policies and practices.§ §Experience with the maintenance of plate washers and incubators is desired.§ §Skilled in centrifuging and either manual or electric pipetting (multi-channel is a bonus)§ §You will be computer savvy and have exposure to a Laboratory Information Management System (LIMS).§ §You will have the ability to learn new systems and processes quickly.§ §Intermediate Microsoft Excel skills are highly desired.§ §You will be confident operating under pressure and time constraints without compromising on quality control procedures and practices.§ § § §What we offer:§ § § § §An opportunity for you to make your mark alongside the New Zealand business, where we are focused and passionate about the wellbeing and health of pets, people and livestock.§ §A strong supportive infrastructure and assistance where needed, from a highly respected and valued, laboratory team.§ §A close-knit team environment, where there is a tendency to celebrate Fridays with morning tea, and a sense of humour is appreciated.§ § § §If you are passionate about making a difference and being rewarded for your efforts, please§ APPLY §or contact Kathryn Kelly, Talent Acquisition Specialist - §Kathryn-Kelly@idexx.com§.§ §If you would like to learn more about IDEXX and that we do please take a look at our website at https://www.idexx.co.nz/en-nz/§§§§"
